,Publish Time,Title,Article
0,2021-07-23 12:51:00,旅游板块连跌三个月:权重股无一上涨 但基金开始进场抄底了,"['  炒股就看金麒麟分析师研报,权威,专业,及时,全面,助您挖掘潜力主题机会!', '  早盘大小指数齐走弱,沪指跌0.65%,创业板指跌1.78%,两市超3000只个股飘绿,上涨个股仅千余家。', '  有3只新ETF在今日上市——富国中证旅游主题ETF、华安中证内地新能源主题ETF和华夏中证金融科技主题ETF,截至午间收盘,分别-2.44%、-0.49%和-1.7%。', '  板块连跌3个月,首只跟踪旅游的ETF来抄底了', '  富国中证旅游主题ETF', '  (交易代码:159766;场内简称:旅游ETF)', '  旅游ETF本次上市交易的基金份额为2.92亿份,截至2021年7月16日,基金资产组合情况中股票占基金总资产的比例为7.27%;银行存款和结算备付金合计占基金总资产的比例为92.72%。', '  不过,据基金上市交易公告书显示,该基金在上市首日前,基金管理人将使基金的投资组合比例符合有关法律法规、部门规章、规范性文件的规定和基金合同的有关约定。', '  公告书显示,截至2021年7月16日,前十大重仓股中,中国中免、宋城演艺占净值比均超1%;从近三个月涨跌幅看,前十大重仓股集体下跌,板块指数连跌3个月,其中宋城演艺、上海机场跌逾20%。', '  旅游ETF跟踪标的为中证旅游主题指数(指数代码为:930633),该指数以2008年12月31日为基日,以1000点为基点,截至7月22日,最新收盘报4136.86点,近三个月该指数累计下跌15.74%。', '  公开资料显示,中证旅游主题指数从沪深市场中选取不超过50家业务涉及旅游住宿、旅游游览、旅游购物、旅游娱乐、旅游综合服务、旅游出行、旅游餐饮、旅游地产开发等旅游产业链的上市公司证券作为指数样本,以反映旅游主题上市公司证券的整体表现。', '  值得注意的是,旅游ETF为首只上市跟踪中证旅游主题指数的ETF。', '  2只ETF扎堆金融科技', '  华夏中证金融科技主题ETF', '  (交易代码:516100;场内简称:科技金融)', '  科技金融本次上市交易的基金份额为2.41亿份,截至2021年7月16日,基金资产组合情况中股票占基金总资产的比例为19.15%;银行存款和结算备付金合计占基金总资产的比例为80.83%。', '  不过,据基金上市交易公告书显示,该基金在上市首日前,基金管理人将使基金的投资组合比例符合有关法律法规、部门规章、规范性文件的规定和基金合同的有关约定。', '  公告书显示,截至2021年7月16日,前十大重仓股中,东方财富、润和软件、恒生电子和同花顺占净值比均超1%;从近三个月涨跌幅看,前十大重仓股有6只下跌,长亮科技等5只个股跌幅超10%,而润和软件则大涨308.71%,持仓个股分化严重。', '  科技金融跟踪标的为中证金融科技主题指数(指数代码为:930986),该指数以2014年6月30日为基日,以1000点为基点,截至7月22日,最新收盘报2325.97点,近三个月该指数累计上涨12.4%。', '  公开资料显示,中证金融科技主题指数选取产品与服务与金融科技领域相关的上市公司作为样本股,相关的领域包括但不限于支付清算、网络借贷融资、财富管理、零售银行、保险、交易结算以及其他运用大数据、云计算、人工智能、区块链等信息化技术参与金融产品与服务价值链的公司,旨在反映相关领域的A股上市公司整体表现。', '  目前有2只ETF跟踪中证金融科技主题指数,规模较大的是今日上市的科技金融ETF,规模为2.41亿元,而3月19日上市的金科ETF,上市至今份额累计减少了2.05亿份,目前规模不足亿元。', '  2只跟踪中证金融科技主题指数的ETF', '  华安中证内地新能源主题ETF', '  (交易代码:516270;场内简称:新能源50)', '  新能源50本次上市交易的基金份额为4.42亿份,截至2021年7月16日,基金资产组合情况中股票占基金总资产的比例为23.17%;银行存款和结算备付金合计占基金总资产的比例为76.82%。', '  不过,据基金上市交易公告书显示,该基金在上市首日前,基金管理人将使基金的投资组合比例符合有关法律法规、部门规章、规范性文件的规定和基金合同的有关约定。', '  公告书显示,截至2021年7月16日,前十大重仓股中,隆基股份、宁德时代占净值比均超3%;从近三个月涨跌幅看,前十大重仓股集体上涨,其中恩捷股份大涨115.31%。', '  新能源50跟踪标的为中证内地新能源主题指数(指数代码为:000941),该指数以2008年12月31日为基日,以1000点为基点,截至7月22日,最新收盘报4144.18点,近三个月该指数累计上涨48.33%。', '  公开资料显示,中证内地新能源主题指数从沪深市场中涉及新能源生产、新能源存储以及新能源汽车等业务的上市公司证券中选取新能源业务规模较大、盈利较好的50只样本作为指数样本,为市场提供多样化的投资标的。']"
1,2021-07-23 12:37:06,医美不香了？三大千亿白马集体重挫 汽车、券商股却火了,"['  炒股就看金麒麟分析师研报,权威,专业,及时,全面,助您挖掘潜力主题机会!', '  中国基金报记者吴羽', '  太惨烈!今天早盘的A股,各大“茅”族跌得让人心慌,“男人的胃女人的脸”都不管用了,医疗、医美、白酒等指数跌幅靠前,茅指数跌超2%!', '  而万万没想到,最后护盘的竟是券商。', '   “喝酒吃药”集体熄火', '  千亿医美龙头跌近10%', '  “男人的胃女人的脸”都不管用了,今天早盘,,医疗、医美、白酒等指数继续跌幅靠前。', '  白酒指数跌收跌3.75%。', '  水井坊跌近7%、口子窖跌近6%,舍得酒业(维权)、老白干等也跌幅靠前。', '  医美股也集体崩了,指数大跌超4%。', '  其中,三大千亿医美巨头更是跌幅靠前。贝泰妮跌近10%,市值仅剩1016亿元。', '  爱美客收跌6.61%。', '  华熙生物跌近8%。', '  此外,凯莱英、智飞生物、药明康德(维权)、迈瑞医疗、长春高新、通策医疗的医药股也跌幅靠前。', '  千亿“扫地茅”又跌停了!', '  7天跌超360亿', '  千亿“扫地茅”科沃斯今天又跌停了。这是科沃斯近七个交易日里的第三个跌停。最新股价已经不足200元,为190.21元每股。', '  此前,7月16日和22日(昨日),科沃斯均以跌停收盘。值得注意的是,7月15日,科沃斯股价刚创出252.71元每股的高点,如今已迅速跌去25%。市值也相较于7天前的高点已经蒸发超360亿元至1089亿元。', '  而消息上,7月13日,科沃斯发布公告称,泰怡凯拟减持股份数量合计1027.96万股,即不超过科沃斯当前总股本的1.80%,这也是一次“清仓式”减持。科沃斯上市后,泰怡凯多次减持科沃斯股票,预计累计套现45.59亿元。', '  此外,科沃斯的高估也是市场担忧的主要元素。2020年,科沃斯实现归母净利润6.41亿元,虽然同比增长431.22%,但6亿净利润能否撑起千亿市值,一直为市场热议。', '  同为扫地龙头石头科技也收跌近6%。', '  茅指数大跌超2%', '  在上述热门板块龙头股的集体重挫下,“茅指数”也在今天早盘跌2.36%。', '  除了上述个股,片仔癀在昨天跌停后,今天继续重挫近7%。', '  不仅如此,宁组合指数也跌超2%。', '  锂电大牛股业绩爆冷', '  跌超12%', '  刚暴涨超160%的锂电大牛股久吾高科,今天暴跌超12%。', '  因为业绩爆冷。22日晚,久吾高科披露2021年上半年业绩预告,预计净利润850万元-1200万元,比上年同期下降59.53%-42.86%。 ', '  公告显示,报告期内业绩变动主要原因为:收到的政府补助较上年同期相比下降较多,同时,因原材料价格变动以及部分新领域示范项目毛利率偏低等因素造成综合毛利率较上年同期相比有所下降,从而导致本报告期归属于上市股东的净利润有所下降。', '  值得注意的是,在今天暴跌之前,久吾高科刚连续斩获两个20%涨停,一个月的时间更是暴涨超160%。', '  实控人被抓', '  深南股份跌停', '  深南股份开盘后迅速封死跌停。', '  7月22日,深南股份发布公告称,“今日收到公司控股股东、实际控制人周世平家属的通知,周世平已被深圳市公安局福田分局采取刑事强制措施。”值得注意的是,周世平是曾是国内领先P2P网贷平台红岭创投的创始人。', '   券商护盘', '   中泰证券、东方证券双双涨停', '  此前领涨先锋一派低迷之下,券商股护盘了!盘中直线拉涨近3%,收涨2.11%。', '  板块内个股全线飘红,中泰证券涨停,实现两连板。东方证券也收涨停。财达证券涨超8%、中金公司直线上攻。', '  周期板块集体补涨', '  此前涨幅一直落后的镍矿、钴矿及汽车整车开始补涨。', '  行业方面,全球矿业巨头必和必拓22日宣布,与特斯拉签署镍供应协议,必和必拓旗下的西部镍业将为特斯拉提供作为电池制造原料的镍。必和必拓方面预计,电池制造对镍的需求将在未来十年增长五倍以上,主要用于支持日益增长的电动汽车市场。据上海有色网数据,今年上半年国内三元前驱体对镍需求量达到9.67万吨,同比增长153%。', '  受此影响,概念股集体大涨,青岛中程(维权)一字大板,鹏欣资源秒板,格林美、盛屯矿业等多股均一度涨停,最终收涨超6%。', '  煤炭股不断走强,陕西黑猫、华阳股份先后涨停,山西焦煤大涨超5%。', '  新能源整车则依旧持续发力,江淮汽车涨停,长城汽车、东风汽车涨超6%,比亚迪涨近4%。7月22日晚间,长城汽车公告,推出规模庞大的股权激励计划,进一步刺激股价上涨,最新市值逼近4200亿元。', '  北上资金净卖出超35亿元', '  截至午盘,上证指数下跌0.65%报3551.55点,深证成指跌1.41%,创业板指跌1.78%报3481.32点,万得全A跌1%。 ', '  两市半日放量成交近9000亿元,北向资金净卖出超35亿元。']"
2,2021-07-23 11:34:11,午后名博看市：轻指数重结构是时候进行调仓换股了,"['  炒股就看金麒麟分析师研报,权威,专业,及时,全面,助您挖掘潜力主题机会!', '  7月23日消息,A股三大指数全线低开,钢铁板块开盘活跃。随后指数集体下行,创指失守3500点,CRO概念、医疗器械、基因测序等医药股大幅回调,钴、煤炭、黄金、稀土等资源类周期股逆势上涨。盘中指数震荡下挫,盐湖提锂、汽车、化工股走强,证券、半导体、HIT电池短线拉升;白酒、旅游、饮料、白色家电、食品等消费股重创,鸿蒙概念、数字货币、造纸板块持续走弱。总体来看,市场情绪较为低迷,部分前期热门题材全面回调,两市逾3300个股下跌。', '  冯矿伟:消化画线压力', '  券商今天发力,可惜指数不跟,这是上午收盘前那一波下跌根源,很多次了,都是券商拉升大盘不跟,券商走低,大盘跌的更快,这次也一样,好在券商上午已经有2个涨停股了,券商如果上演涨停潮,大盘还会起来,否则今天指数就是消化压力的一天。', '  郭一鸣:轻指数重结构是时候进行调仓换股了', '  近期市场依然反复,尽管成交量持续过万亿,但指数没有出现较大幅度的上涨,这便说明当前环境下,市场出现趋势性行情的概率比较低,而更多的还是反复提及的结构性行情。在这种行情当中,不能随意因为上涨就过分的看多,也不能因为下跌就认为行情走弱,整体还是建议轻指数而重机构。', '  当前,公募基金二季度持仓和盘托出,配置较多的是创业板以及科创板,而板块上则是对消费以及医药等适当减持,更多的还是加仓了成长类品种。', '  张春林:券商王者归来', '  今天的亮点在顺周期和券商板块,这也是我们一直在强调的潜在板块,昨天顺周期四驾马车表现抢眼,今天钢铁、有色和煤炭板块继续位居涨幅榜前列,而券商板块一改怂样,奋力上行,位居早盘涨幅榜首位,其中中泰证券、东方证券放量涨停,券商股有王者归来之迹象。券商要么不涨,一涨就是大阳线,这符合渣男的气质,短线可以继续关注。']"
3,2021-07-23 11:09:31,OLED驱动芯片短缺加剧 国内企业有望迎来巨大成长空间,"['  截至发稿,万业企业、*ST丹邦涨停,华兴原创涨逾14%,联得装备、江化微、凯盛科技等多股纷纷跟涨。', '  7月23日早盘,OLED概念盘中异动拉升,截至发稿,万业企业、*ST丹邦涨停,华兴原创涨逾14%,联得装备、江化微、凯盛科技等多股纷纷跟涨。', '  36氪近日报道,三星显示器、LG显示器下半年将继续投资OLED产线,投资额合计超过7万亿韩元(约合394亿元人民币)。其中,三星将投入3万亿韩元,LG计划投资4-5万亿韩元。', '  据了解,目前,OLED产业上游市场仍然以日韩欧美厂商为主,市场集中在日本出光兴产、堡土谷化学、美国UDC公司以及一些韩国公司。根据机构统计,OLED设备投资金额在2019-2021年分别为460、606、485亿元,检测设备预估占比8-12%,OLED相比LCD会新增激光切割、激光修复、Demura等设备。', '  另据媒体报道,全球“缺芯潮”蔓延至各个领域,OLED驱动芯片也逐渐呈现短缺的迹象。继第一季度的价格上涨之后,2021年第二季度OLED驱动芯片的价格又上涨了20%。', '  近年来,国内新型显示产业蓬勃发展,为产业链上游企业带来巨大发展机遇。', '  数据显示,应用于智能手机、车载娱乐、电视、虚拟现实和智能手表领域的驱动芯片市场规模年增长率分别为10%、12%、16%和67%。目前OLED驱动芯片正面临制造困境,一方面,OLED驱动芯片制造工艺复杂,而且每个OLED驱动芯片都需要定制,芯片代工厂无法大规模量产。台积电、三星等大的晶圆代工厂受产能限制,优先生产其他紧缺的芯片。即使扩产,也不能跟上市场需求增长的速度。此外,OLED驱动芯片相关组件的价格上涨了15%。', '  巨丰投顾分析师表示,在全球智能手机OLED驱动芯片代工市场,三星的市场占有率位列第一,台积电占有10%,目前这两家代工厂都在为缺芯调整产能,OLED驱动芯片产能可能成为下一个紧缺的对象。因此,国内OLED驱动芯片市场将出现巨大需求缺口,国内企业有望迎来巨大的成长空间。']"
4,2021-07-23 09:32:00,MOSFET等芯片产品酝酿新一轮提价 个别产品已涨7-8倍 交货周期延长至4-5月,"['  炒股就看金麒麟分析师研报,权威,专业,及时,全面,助您挖掘潜力主题机会!', '  《科创板日报》(上海,研究员宋子乔)讯,据集微网报道,有业内人士表示,目前MOSFET原厂已有多款产品涨价幅度超过3倍,个别产品可能上涨7-8倍,供货周期也无限延长,预计原厂将在Q4开启一波涨价潮。', '  一位代理商称,MOSFET等芯片产品从今年4月起快速上涨。“目前原厂的产品价格基本都翻倍增长了,个别产品可能上涨7-8倍。比如一款充电用MOSFET产品之前都是0.08元/个,现在是0.25元了,而0.1元的产品基本上涨至0.4亿元以上,涨价幅度基本都在3倍以上。”', '  业内人士表示,“IDM大厂在马来西亚的产能受到影响,将会进一步加剧MOSFET产能偏紧状态,尤其是应用于电源领域的MOSFET产品,目前处于非常短缺阶段,之前的供货周期是两个月,现在有的产品供货周期延长至4-5月了,甚至有的产品根本就没有交期。现在原厂根本不可能供应新客户,只能保证老客户的订单。”', '  “近期国内有个贸易商近期采购单个型号充电用MOSFET产品的金额就有几亿元,或加剧MOSFET供应紧张状态,预计原厂将在Q4开启一波涨价潮。”上述人士表示,其实市场需求并没有那么大,基本上都是贸易商在囤货,两年后这些产品价格存在大幅度下降的可能。', '  另据台湾地区工商时报报道,最近供应链传出,东芝、英飞凌等IDM大厂供货量能仅剩下三分之二,更有部分大厂暂不回复交货周期,其中,以二极管及MOSFET等供货状况受影响的程度最大。', '  据不完全统计,今年上半年,捷捷微电、新洁能、华润微、扬杰科技等多家MOSFET厂商均发布了涨价函。', '  新洁能近期在接受机构调研时表示,涨价是由于上游原材料以及封装成本持续上涨,且产能紧张、投产周期延长,公司产品成本大幅增加,原有价格难以满足供货需求。公司根据成本上涨的情况、结合市场行情以及公司的产品交付等实际情况,对相关产品的价格进行不同幅度的适度调整,故今年整体的产品涨价幅度难以量化。', '  产能紧张背景下,消费/工控/汽车产品对MOSFET需求持续提升,而新一代CPU、GPU平台,都需要加装MOSFET芯片出货。根据IHS的统计,全球MOSFET市场规模将由2019年的76亿美元增长至2023年的92亿美元以上。', '  国泰君安分析师王聪表示,终端需求强劲及8寸代工费涨价趋势较为确定,双重因素将反应至产品价格,功率MOSFET价格有望进一步调涨,而兼具产能优势和成本优势的国内功率IDM企业将最大程度受益。', '  东方证券分析师蒯剑认为,涨价利好具备制造能力的IDM厂和功率半导体代工厂。建议关注国内MOSFET领先IDM厂商华润微、全球汽车低压MOSFET领先IDM厂商闻泰科技,捷捷微电也有望受益,关注功率半导体代工厂商华虹半导体。']"
5,2021-07-23 10:27:16,物业半年报|新大正业绩增长38.4%但市场反应冷淡 增值服务尚无起色,"['  出品:上市公司研究院', '  作者:陈宪', '  7月21日,新大正发布了2021年上半年业绩报告,率先拉开物业板块半年报序幕。公告显示,上半年新大正实现营业收入8.96亿元,同比增长58%;实现归母净利润7.44亿元,同比增长38.4%。加权平均净资产收益率为8.56%,较上年同期提升了1.54个百分点。', '  上半年由于收购的四川民兴物业并表,公司在重庆地区以外的收入增加,全国化布局似乎略有成效。但毛利率因此有所下滑,为19.3%,较去年同期下降2.18个百分点。1年以内的新项目收入占比约20%,这些项目毛利率仅11.4%,拖累盈利。', '  全国化开启重庆占比下降 新项目致毛利率下滑', '  新大正成立于1998年,是重庆市最早一批成立的物业公司之一,目前控最大持股为个人股东王宣。公司在管业态包括学校、航空、公共、办公、商住物业五大业态,是目前A股少有的物业标的。独立第三方的身份使其90%的项目以招投标方式取得。', '  2021年上半年,新大正营业收入同比增长58%,归母净利润同比增长38.4%。不论是营收还是净利润,增幅都创下了近三年来的新高。', '  事实上2018年以来新大正的发展都不算快,业绩增速在18~25%区间。直到2020年,公司面临22.32百万平方米签约面积到期的问题,到期合同占当时签约合同面积比例达到33%。而彼时物业股业绩平均增速在60%左右,公司业绩增长压力较大。', '  面对这种情况,新大正先是4月份挖来了中航物业老将刘文波担任董事兼总裁。刘文波在1998-2019年在中航物业,历任副总经理兼会计、总经理兼董事。随后在5月公布了2021年限制性股票激励计划,刘文波获得0.28%股权激励,占此次股权激励的23.94%。', '  激励计划的解锁条件以2020年数据为基准,要求2021-2025年收入同比增速分别不低于45%、44.8%、42.9%、26.7%、21.1%;净利润同比增速分别不低于35%、40.7%、31.6%、24%、22.6%,未来5年营收/净利润的复合增长率达到35.7%/30.6%。', '  以新大正过往业绩来看,这一解锁条件要求较高。', '  刘文波上任后,新大正即在2020年10月公告以9700万元收购四川民兴物业100%股权,并同时变更上市募资用途。由于原停车场改造计划受阻,公司宣布将跳出原有的业务逻辑,通过市场拓展、收并购合作等方式加速全国化、规模化进程。', '  收购带来的好处显而易见。从2021年中报来看,下半年维持这一增速,彼时较高的业绩目标很可能达成。', '  2021年上半年,公司新进项目收入占比达到了20%。反映在区域上,重庆地区以外的区域收入占比从去年的30.8%提高至47.7%,重庆区域的收入占比为52.34%,而2019年该指标还是82.5%。', '  反映在业态上,公司学校物业、航空物业、公共物业、办公物业、商住物业五大业态协同并进,2021年上半年营收占比分别为16.7%、11.4%、20.0%、34.6%、17.4%;其中办公、公共物业增长迅猛,尤其是办公物业收入占比提高明显,从去年同期的24%提高至34.55%,营收同比增长达到了130.8%,是上半年最“靓”的业务,并购带来该业态的增长是一部分原因。', '  全国化布局固然可喜,不过同样避免不了新项目盈利空间有限的问题。新大正提到毛利率的下滑主要是因为20%的新项目毛利率仅为11.4%,低于成熟项目约10个百分点。这导致新大正上半年净利率仅为8.3%,原本在2020年末艰难站上10%的净利率,再度低迷。', '  随着未来全国化的进一步推行,公司净利率可能进一步下降。当期现金余额较去年末下降了36%,为4.3亿元,收并购有一定操作空间,但无法和龙头雄厚的资金实力相提并论。', '  物业股普遍预期高增长  市场反应冷淡', '  新大正半年报公布后,公司股价微跌0.95%,报收44.97元/股,市场反应略显冷淡。主要是因为近期多家物业股发布了正面盈利预告,普遍利润增长在60%以上。相比之下,新大正38.4%的归母净利润增长就显得一般。', '  比如越秀服务净利润同比增长120%、融创服务拥有人应占溢利增长140%、合景悠活未经审核利润增长不低于150%......', '  与此同时,囿于A股物业股标的稀缺,截至22日收盘新大正市盈率(TTM)为48.2倍,总市值73亿元。公司市盈率(TTM)排52家物业股第8位,而物业股算数平均市盈率(TTM)为30.8倍,以新大正目前不足20亿营收的规模,估值已经处于较高水平。', '  加之新大正目前收入结构仍然是以基础的物业管理服务为主,增值服务占比较小。2021年上半年两大业务分别同比增长59.04%、42.55%,增值服务收入占比从上年同期6.3%下降到5.65,可以说在如何寻求第二增长曲线上面,新大正是毫无起色。', '  基于此前提出的股权激励业绩目标,新大正未来几年很可能持续进行收并购以促增长。']"
