,Publish Time,Title,Article
166,2021-07-23 08:42:08,7月22日融资余额16663.78亿元 环比增加73.46亿元,"['  炒股就看金麒麟分析师研报,权威,专业,及时,全面,助您挖掘潜力主题机会!', '  原标题:7月22日融资余额16663.78亿元,环比增加73.46亿元', '  每经AI快讯,据交易所最新公布的数据显示,截至7月22日,沪深两市的融资融券余额为18260.66亿元,环比增加93.49亿元,其中融资余额16663.78亿元,环比增加73.46亿元。分市场来看,沪市两融余额为9792.56亿元,环比增加62.69亿元,深市两融余额8468.1亿元,环比增加30.8亿元。', '  7月22日两市共有1017只个股有融资资金净买入。共有46只股票融资净买入额占总成交金额比例超10%,其中唐山港、国睿科技、日照港排名前三,占比分别为22.8%、21.99%、20.52%。', '  从融资资金净买入金额来看,共有31只个股净买入金额超亿元,其中大全能源、复星医药、多氟多排名前三,买入金额分别为8.98亿元、4.12亿元、3.5亿元。', '  (记者周宇翔)', '  免责声明:本文内容与数据仅供参考,不构成投资建议,使用前核实。据此操作,风险自担。']"
167,2021-07-23 08:34:16,7月22日40只个股获券商关注 菱电电控目标涨幅达114.05%,"['  炒股就看金麒麟分析师研报,权威,专业,及时,全面,助您挖掘潜力主题机会!', '  原标题:7月22日40只个股获券商关注,菱电电控目标涨幅达114.05%', '  每经AI快讯,7月22日,券商给予评级的个股数共有40只,获得买入评级的个股数共有34只。在公布了目标价格的9只个股中,按照最新收盘价计算,预期涨幅排名居前的个股是菱电电控(688667.SH)、川恒股份(002895.SZ)、紫光股份(000938.SZ),预期涨幅分别是114.05%、67.37%、54.91%。', '  从券商对个股的关注程度来看,有5只个股获得多家券商关注,券商关注数量排名居前的个股是移为通信(300590.SZ)、浙江美大(002677.SZ)、新大正(002968.SZ)。', '  从券商对行业的关注度来看,券商关注个股数居前的行业分别是电子、化工、电气设备。', '  (记者周宇翔)', '  免责声明:本文内容与数据仅供参考,不构成投资建议,使用前核实。据此操作,风险自担。']"
168,2021-07-23 07:01:52,北向资金动向曝光：7月22日这30只个股遭大甩卖（附名单）,"['  炒股就看金麒麟分析师研报,权威,专业,及时,全面,助您挖掘潜力主题机会!', '  原标题:北向资金动向曝光:7月22日这30只个股遭大甩卖(附名单)', '  每经AI快讯,7月22日,北上资金净卖出的个股共有585只,北上资金减仓比例超1%的有519只。其中,中材科技(002080.SZ,收盘价:27.6元)减仓比例最为明显,最新持股比例18.28%,环比减少1.52个百分点。其他北上资金减仓比例较多的个股还包括浙江美大(002677.SZ,收盘价:16.4元)、鸿利智汇(300219.SZ,收盘价:14.33元)、承德露露(000848.SZ,收盘价:12.05元)。', '  7月22日,按照北向资金减持市值排序,片仔癀(600436.SH,收盘价:440.78元)减持市值最大,减持市值5.608亿元,环比减少5.34%。其他北上资金减持市值较多的个股还包括复星医药(600196.SH,收盘价:77.8元)、北方稀土(600111.SH,收盘价:40.59元)、恩捷股份(002812.SZ,收盘价:267.0元)。', '  *榜单已剔除计算区间内涉及股权登记的个股', '  (记者周宇翔)', '  免责声明:本文内容与数据仅供参考,不构成投资建议,使用前核实。据此操作,风险自担。']"
169,2021-07-23 07:01:38,揭秘北上资金：连续5日加仓这些个股（附名单）,"['  炒股就看金麒麟分析师研报,权威,专业,及时,全面,助您挖掘潜力主题机会!', '  原标题:揭秘北上资金:连续5日加仓这些个股(附名单)', '  每经AI快讯,7月22日,北上资金连续5个交易日买入57个股。北上资金连续5个交易日加仓个股中,大洋电机(002249.SZ,收盘价:7.13元)5个交易日获增持1.64个百分点,其他增持比例较大的个股包括保隆科技(603197.SH,收盘价:36.44元)、和而泰(002402.SZ,收盘价:27.61元)、欧派家居(603833.SH,收盘价:142.38元),分别增持1.38个百分点、1.07个百分点、1.03个百分点。', '  *榜单已剔除计算区间内涉及股权登记的个股', '  (记者周宇翔)', '  免责声明:本文内容与数据仅供参考,不构成投资建议,使用前核实。据此操作,风险自担。']"
170,2021-07-23 07:01:14,揭秘北上资金：连续5日减仓这些个股（附名单）,"['  原标题:揭秘北上资金:连续5日减仓这些个股(附名单)', '  每经AI快讯,7月22日,北上资金连续5个交易日卖出47个股。北上资金连续5个交易日减仓个股中,新易盛(300502.SZ,收盘价:37.44元)5个交易日遭减持1.63百分点,其他减持幅度较大的个股包括兴发集团(600141.SH,收盘价:28.08元)、蒙娜丽莎(002918.SZ,收盘价:26.55元)、深圳机场(000089.SZ,收盘价:7.55元),分别减持1.17个百分点、1.03个百分点、0.78个百分点。', '  *榜单已剔除计算区间内涉及股权登记的个股', '  (记者周宇翔)', '  免责声明:本文内容与数据仅供参考,不构成投资建议,使用前核实。据此操作,风险自担。']"
171,2021-07-23 07:00:48,北向资金动向曝光：7月22日这30只个股被猛烈扫货（附名单）,"['  炒股就看金麒麟分析师研报,权威,专业,及时,全面,助您挖掘潜力主题机会!', '  原标题:北向资金动向曝光:7月22日这30只个股被猛烈扫货(附名单)', '  每经AI快讯,7月22日,北上资金净买入的个股共有784只,北上资金加仓比例超1%的有714只。其中,协鑫集成(002506.SZ,收盘价:4.34元)加仓比例最为明显,最新持股比例5.30%,环比增加1.13个百分点。其他北上资金加仓比例较多的个股还包括浙江医药(600216.SH,收盘价:19.42元)、大洋电机(002249.SZ,收盘价:7.13元)、上海新阳(300236.SZ,收盘价:53.3元)。', '  7月22日,按照北向资金增持市值排序,歌尔股份(002241.SZ,收盘价:38.18元)增持市值最大,增持市值7.087亿元,环比增加7.79%。其他北上资金增持市值较多的个股还包括中国平安(601318.SH,收盘价:58.54元)、三一重工(600031.SH,收盘价:27.65元)、迈瑞医疗(300760.SZ,收盘价:452.0元)。', '  *榜单已剔除计算区间内涉及股权登记的个股', '  (记者周宇翔)', '  免责声明:本文内容与数据仅供参考,不构成投资建议,使用前核实。据此操作,风险自担。']"
172,2021-07-23 01:19:03,重仓股座次洗牌 公募基金二季报三大看点不容忽视,"['  原标题:公募基金二季报三大看点不容忽视', '  本报记者 王思文', '  随着2021年公募基金二季报披露收官,公募基金收益情况、持股变动以及基金经理的投资策略逐渐浮出水面。“茅指数”成份股下降了多少?鸿蒙概念股如何演绎?科技股行情共识形成了没有?这些市场核心问题,在公募基金二季报里几乎都藏有答案。总的来说,基金二季报有以下三大看点不容忽视:', '  一是重仓股座次洗牌。今年二季度,股市“核心资产”走势出现分化,基金经理的持股风格也有分化。行业配置方面,电子、化工、电气设备、医药生物、汽车板块的重仓地位明显增强,而银行、地产、保险、食品饮料、家用电器则有所弱化。整体来看,公募基金的重仓个股仍围绕食品饮料、医药生物、电子为主的消费和科技板块,金融和地产板块仍处低配阶段。', '  从二季度基金重仓股座次看,除了贵州茅台仍然稳坐榜首以外,前20名重仓股仓位有升有落,变化明显。从基金持有股份数来看,药明康德(维权)、隆基股份、迈瑞医疗和东方财富挤进前十,分别排在第5、第6、第7和第10位,亿纬锂能、立讯精密、宁波银行和汇川技术成功跻身前二十大重仓股;而中国平安、美的集团、兴业银行则被“挤出”前十榜单,格力电器、恒瑞医药、长春高新、万科A、三一重工更是排到二十名开外。', '  二季度基金配置缘何调整?整体看,今年以来全球经济复苏形成共振,这给资产配置带来明显影响,分母端的估值驱动力明显转弱,分子端的业绩高增长成为备受关注的市场突破口。', '  二是主动偏股型基金更爱投“双创”。受二季度结构性行情影响,基金在板块间的配置比例有所变动,“双创”题材被基金经理解读为“估值洼地”。权威数据显示,在主动偏股型基金中,创业板的重仓仓位由一季度的18.3%提升到25%;科创板的重仓仓位今年一季度降至2.5%后,二季度回升至4.1%;主板的重仓仓位虽占比仍然最大,但在二季度出现了明显下滑。', '  实际上,创业板和科创板两个市场已经聚集了多只高科技、高成长的新兴产业龙头公司,覆盖医药、新能源、电子等多个高景气度板块的投资机会,这就不难理解一些基金经理加仓电子、新能源、科技等领域股票。', '  三是基金经理的“信”不再“高冷”。“报告期内基金的投资策略和运作分析”一直是基金定期报告中最受投资者关注的内容,市场经常把其称之为“基金经理给基金持有人的一封信”。今年二季报基金经理“寄”来的信似乎比以往更长、更诚恳,尤其是人们耳熟能详的那些顶流基金经理们的信。', '  市场风格以及估值方法是每封“信”的必选项内容。银华基金焦巍感慨,自己无法确认是不是再好的公司也有涨幅顶和估值顶;张坤坦言,似乎现在只有使用远期市值贴现的估值方法,才能获得一个可以接受的回报率;邬传雁透露,二季度花了不少时间和客户沟通投资的长期主义;冯波感叹在高估值水平下要超预期很难......', '  面对市场的变化,基金经理坦诚、直率。傅鹏博重点布局化合物半导体材料、电动智能转型和电子烟;萧楠调整食品饮料板块的持仓结构;冯明远增持新能源和半导体等科技领域......', '  其实,这些顶流基金经理也不是完人,投资者应该理解他们的忧虑、苦恼,抱着共建的心态,多送出善意的鼓励,这个市场才能更美好。']"
173,2021-07-23 12:51:00,旅游板块连跌三个月:权重股无一上涨 但基金开始进场抄底了,"['  炒股就看金麒麟分析师研报,权威,专业,及时,全面,助您挖掘潜力主题机会!', '  早盘大小指数齐走弱,沪指跌0.65%,创业板指跌1.78%,两市超3000只个股飘绿,上涨个股仅千余家。', '  有3只新ETF在今日上市——富国中证旅游主题ETF、华安中证内地新能源主题ETF和华夏中证金融科技主题ETF,截至午间收盘,分别-2.44%、-0.49%和-1.7%。', '  板块连跌3个月,首只跟踪旅游的ETF来抄底了', '  富国中证旅游主题ETF', '  (交易代码:159766;场内简称:旅游ETF)', '  旅游ETF本次上市交易的基金份额为2.92亿份,截至2021年7月16日,基金资产组合情况中股票占基金总资产的比例为7.27%;银行存款和结算备付金合计占基金总资产的比例为92.72%。', '  不过,据基金上市交易公告书显示,该基金在上市首日前,基金管理人将使基金的投资组合比例符合有关法律法规、部门规章、规范性文件的规定和基金合同的有关约定。', '  公告书显示,截至2021年7月16日,前十大重仓股中,中国中免、宋城演艺占净值比均超1%;从近三个月涨跌幅看,前十大重仓股集体下跌,板块指数连跌3个月,其中宋城演艺、上海机场跌逾20%。', '  旅游ETF跟踪标的为中证旅游主题指数(指数代码为:930633),该指数以2008年12月31日为基日,以1000点为基点,截至7月22日,最新收盘报4136.86点,近三个月该指数累计下跌15.74%。', '  公开资料显示,中证旅游主题指数从沪深市场中选取不超过50家业务涉及旅游住宿、旅游游览、旅游购物、旅游娱乐、旅游综合服务、旅游出行、旅游餐饮、旅游地产开发等旅游产业链的上市公司证券作为指数样本,以反映旅游主题上市公司证券的整体表现。', '  值得注意的是,旅游ETF为首只上市跟踪中证旅游主题指数的ETF。', '  2只ETF扎堆金融科技', '  华夏中证金融科技主题ETF', '  (交易代码:516100;场内简称:科技金融)', '  科技金融本次上市交易的基金份额为2.41亿份,截至2021年7月16日,基金资产组合情况中股票占基金总资产的比例为19.15%;银行存款和结算备付金合计占基金总资产的比例为80.83%。', '  不过,据基金上市交易公告书显示,该基金在上市首日前,基金管理人将使基金的投资组合比例符合有关法律法规、部门规章、规范性文件的规定和基金合同的有关约定。', '  公告书显示,截至2021年7月16日,前十大重仓股中,东方财富、润和软件、恒生电子和同花顺占净值比均超1%;从近三个月涨跌幅看,前十大重仓股有6只下跌,长亮科技等5只个股跌幅超10%,而润和软件则大涨308.71%,持仓个股分化严重。', '  科技金融跟踪标的为中证金融科技主题指数(指数代码为:930986),该指数以2014年6月30日为基日,以1000点为基点,截至7月22日,最新收盘报2325.97点,近三个月该指数累计上涨12.4%。', '  公开资料显示,中证金融科技主题指数选取产品与服务与金融科技领域相关的上市公司作为样本股,相关的领域包括但不限于支付清算、网络借贷融资、财富管理、零售银行、保险、交易结算以及其他运用大数据、云计算、人工智能、区块链等信息化技术参与金融产品与服务价值链的公司,旨在反映相关领域的A股上市公司整体表现。', '  目前有2只ETF跟踪中证金融科技主题指数,规模较大的是今日上市的科技金融ETF,规模为2.41亿元,而3月19日上市的金科ETF,上市至今份额累计减少了2.05亿份,目前规模不足亿元。', '  2只跟踪中证金融科技主题指数的ETF', '  华安中证内地新能源主题ETF', '  (交易代码:516270;场内简称:新能源50)', '  新能源50本次上市交易的基金份额为4.42亿份,截至2021年7月16日,基金资产组合情况中股票占基金总资产的比例为23.17%;银行存款和结算备付金合计占基金总资产的比例为76.82%。', '  不过,据基金上市交易公告书显示,该基金在上市首日前,基金管理人将使基金的投资组合比例符合有关法律法规、部门规章、规范性文件的规定和基金合同的有关约定。', '  公告书显示,截至2021年7月16日,前十大重仓股中,隆基股份、宁德时代占净值比均超3%;从近三个月涨跌幅看,前十大重仓股集体上涨,其中恩捷股份大涨115.31%。', '  新能源50跟踪标的为中证内地新能源主题指数(指数代码为:000941),该指数以2008年12月31日为基日,以1000点为基点,截至7月22日,最新收盘报4144.18点,近三个月该指数累计上涨48.33%。', '  公开资料显示,中证内地新能源主题指数从沪深市场中涉及新能源生产、新能源存储以及新能源汽车等业务的上市公司证券中选取新能源业务规模较大、盈利较好的50只样本作为指数样本,为市场提供多样化的投资标的。']"
174,2021-07-23 12:37:06,医美不香了？三大千亿白马集体重挫 汽车、券商股却火了,"['  炒股就看金麒麟分析师研报,权威,专业,及时,全面,助您挖掘潜力主题机会!', '  中国基金报记者吴羽', '  太惨烈!今天早盘的A股,各大“茅”族跌得让人心慌,“男人的胃女人的脸”都不管用了,医疗、医美、白酒等指数跌幅靠前,茅指数跌超2%!', '  而万万没想到,最后护盘的竟是券商。', '   “喝酒吃药”集体熄火', '  千亿医美龙头跌近10%', '  “男人的胃女人的脸”都不管用了,今天早盘,,医疗、医美、白酒等指数继续跌幅靠前。', '  白酒指数跌收跌3.75%。', '  水井坊跌近7%、口子窖跌近6%,舍得酒业(维权)、老白干等也跌幅靠前。', '  医美股也集体崩了,指数大跌超4%。', '  其中,三大千亿医美巨头更是跌幅靠前。贝泰妮跌近10%,市值仅剩1016亿元。', '  爱美客收跌6.61%。', '  华熙生物跌近8%。', '  此外,凯莱英、智飞生物、药明康德(维权)、迈瑞医疗、长春高新、通策医疗的医药股也跌幅靠前。', '  千亿“扫地茅”又跌停了!', '  7天跌超360亿', '  千亿“扫地茅”科沃斯今天又跌停了。这是科沃斯近七个交易日里的第三个跌停。最新股价已经不足200元,为190.21元每股。', '  此前,7月16日和22日(昨日),科沃斯均以跌停收盘。值得注意的是,7月15日,科沃斯股价刚创出252.71元每股的高点,如今已迅速跌去25%。市值也相较于7天前的高点已经蒸发超360亿元至1089亿元。', '  而消息上,7月13日,科沃斯发布公告称,泰怡凯拟减持股份数量合计1027.96万股,即不超过科沃斯当前总股本的1.80%,这也是一次“清仓式”减持。科沃斯上市后,泰怡凯多次减持科沃斯股票,预计累计套现45.59亿元。', '  此外,科沃斯的高估也是市场担忧的主要元素。2020年,科沃斯实现归母净利润6.41亿元,虽然同比增长431.22%,但6亿净利润能否撑起千亿市值,一直为市场热议。', '  同为扫地龙头石头科技也收跌近6%。', '  茅指数大跌超2%', '  在上述热门板块龙头股的集体重挫下,“茅指数”也在今天早盘跌2.36%。', '  除了上述个股,片仔癀在昨天跌停后,今天继续重挫近7%。', '  不仅如此,宁组合指数也跌超2%。', '  锂电大牛股业绩爆冷', '  跌超12%', '  刚暴涨超160%的锂电大牛股久吾高科,今天暴跌超12%。', '  因为业绩爆冷。22日晚,久吾高科披露2021年上半年业绩预告,预计净利润850万元-1200万元,比上年同期下降59.53%-42.86%。 ', '  公告显示,报告期内业绩变动主要原因为:收到的政府补助较上年同期相比下降较多,同时,因原材料价格变动以及部分新领域示范项目毛利率偏低等因素造成综合毛利率较上年同期相比有所下降,从而导致本报告期归属于上市股东的净利润有所下降。', '  值得注意的是,在今天暴跌之前,久吾高科刚连续斩获两个20%涨停,一个月的时间更是暴涨超160%。', '  实控人被抓', '  深南股份跌停', '  深南股份开盘后迅速封死跌停。', '  7月22日,深南股份发布公告称,“今日收到公司控股股东、实际控制人周世平家属的通知,周世平已被深圳市公安局福田分局采取刑事强制措施。”值得注意的是,周世平是曾是国内领先P2P网贷平台红岭创投的创始人。', '   券商护盘', '   中泰证券、东方证券双双涨停', '  此前领涨先锋一派低迷之下,券商股护盘了!盘中直线拉涨近3%,收涨2.11%。', '  板块内个股全线飘红,中泰证券涨停,实现两连板。东方证券也收涨停。财达证券涨超8%、中金公司直线上攻。', '  周期板块集体补涨', '  此前涨幅一直落后的镍矿、钴矿及汽车整车开始补涨。', '  行业方面,全球矿业巨头必和必拓22日宣布,与特斯拉签署镍供应协议,必和必拓旗下的西部镍业将为特斯拉提供作为电池制造原料的镍。必和必拓方面预计,电池制造对镍的需求将在未来十年增长五倍以上,主要用于支持日益增长的电动汽车市场。据上海有色网数据,今年上半年国内三元前驱体对镍需求量达到9.67万吨,同比增长153%。', '  受此影响,概念股集体大涨,青岛中程(维权)一字大板,鹏欣资源秒板,格林美、盛屯矿业等多股均一度涨停,最终收涨超6%。', '  煤炭股不断走强,陕西黑猫、华阳股份先后涨停,山西焦煤大涨超5%。', '  新能源整车则依旧持续发力,江淮汽车涨停,长城汽车、东风汽车涨超6%,比亚迪涨近4%。7月22日晚间,长城汽车公告,推出规模庞大的股权激励计划,进一步刺激股价上涨,最新市值逼近4200亿元。', '  北上资金净卖出超35亿元', '  截至午盘,上证指数下跌0.65%报3551.55点,深证成指跌1.41%,创业板指跌1.78%报3481.32点,万得全A跌1%。 ', '  两市半日放量成交近9000亿元,北向资金净卖出超35亿元。']"
175,2021-07-23 11:09:31,OLED驱动芯片短缺加剧 国内企业有望迎来巨大成长空间,"['  截至发稿,万业企业、*ST丹邦涨停,华兴原创涨逾14%,联得装备、江化微、凯盛科技等多股纷纷跟涨。', '  7月23日早盘,OLED概念盘中异动拉升,截至发稿,万业企业、*ST丹邦涨停,华兴原创涨逾14%,联得装备、江化微、凯盛科技等多股纷纷跟涨。', '  36氪近日报道,三星显示器、LG显示器下半年将继续投资OLED产线,投资额合计超过7万亿韩元(约合394亿元人民币)。其中,三星将投入3万亿韩元,LG计划投资4-5万亿韩元。', '  据了解,目前,OLED产业上游市场仍然以日韩欧美厂商为主,市场集中在日本出光兴产、堡土谷化学、美国UDC公司以及一些韩国公司。根据机构统计,OLED设备投资金额在2019-2021年分别为460、606、485亿元,检测设备预估占比8-12%,OLED相比LCD会新增激光切割、激光修复、Demura等设备。', '  另据媒体报道,全球“缺芯潮”蔓延至各个领域,OLED驱动芯片也逐渐呈现短缺的迹象。继第一季度的价格上涨之后,2021年第二季度OLED驱动芯片的价格又上涨了20%。', '  近年来,国内新型显示产业蓬勃发展,为产业链上游企业带来巨大发展机遇。', '  数据显示,应用于智能手机、车载娱乐、电视、虚拟现实和智能手表领域的驱动芯片市场规模年增长率分别为10%、12%、16%和67%。目前OLED驱动芯片正面临制造困境,一方面,OLED驱动芯片制造工艺复杂,而且每个OLED驱动芯片都需要定制,芯片代工厂无法大规模量产。台积电、三星等大的晶圆代工厂受产能限制,优先生产其他紧缺的芯片。即使扩产,也不能跟上市场需求增长的速度。此外,OLED驱动芯片相关组件的价格上涨了15%。', '  巨丰投顾分析师表示,在全球智能手机OLED驱动芯片代工市场,三星的市场占有率位列第一,台积电占有10%,目前这两家代工厂都在为缺芯调整产能,OLED驱动芯片产能可能成为下一个紧缺的对象。因此,国内OLED驱动芯片市场将出现巨大需求缺口,国内企业有望迎来巨大的成长空间。']"
