,Publish Time,Title,Article
96,2021年07月25日 21:51,管涛从七个方面建言推进人民币国际化：人民币在SDR权重第3 有追赶空间,"['  炒股就看金麒麟分析师研报,权威,专业,及时,全面,助您挖掘潜力主题机会!', '  管涛从七个方面建言推进人民币国际化:人民币在SDR权重第3,有追赶空间', '  来源:凭澜观涛', '  “中国现在经济体量很大,贸易、投融资规模比较大,投资现状和潜力相差比较大。人民币是SDR里头第三大权重货币,占比10.9%,我们有追赶空间。”7月24日,中银证券全球首席经济学家、国家外汇管理局国际收支司原司长管涛在“2021青岛-中国财富论坛”上表示。', '  管涛从七个方面建言推进人民币国际化:', '  第一个方面,加快构建新发展格局,通过供给侧改革和高水平开放实现高质量发展。从过去追求经济增长速度转向经济增长的质量,只有把经济搞好了,货币国际化才能行稳致远,更好地走出国门。', '  第二个方面,加快国内金融市场发展,让金融市场有深度广度、有流动性。特别是要加快境内外汇市场发展。目前,人民币在全球交易量第八。', '  第三个方面,就是提高我们的对外开放水平,要从过去的商品要素流动性开放转向制度性开放。于此同时,管涛如是指出,开放尽可能稳中求进,避免政策的反复。', '  第四个方面,加快构建现代的财税金融体系,提高宏观调控效率,促进经济健康平稳发展,同时提高政策透明度和公信力,保持人民币的实际购买力,增强人民币资产的国际吸引力。', '  第五个方面,应该有一个差异化,在人民币走出国门的过程中,通过制度建设,基础设施的完善,为人民币的跨境流通使用创造更加便捷、低成本的,更加市场友好型的环境。', '  第六个方面,坚持创新发展,加快转变外贸发展方式,从以价取胜转向以质取胜。目前为止,跨境贸易用人民币计价结算不到15%,重要原因就是我们的企业在国际贸易中没有议价能力,缺乏定价权。', '  第七个方面,按照“十四五”规划提出来的,提高开放环境下的风险防范和应对能力,要完善我们的监管手段,从过去的行政审批数量控制为主专项宏微观审慎相结合的措施。同时,还要加强国际收支流量和存量的统计监测。', '  以下为部分发言实录:', '  管涛:非常高兴再次的参加财富论坛,去年讨论了制度型开放的问题,今天我结合学习“十四五”规划纲要,谈谈对金融开放的想法。', '  现实中,我经常听到一种说法,说中国现在经济体量很大,跨境贸易和投融资规模比较大,但人民币国际化程度与之相比远远不能匹配。大家常用的一个参考指标是,人民币是国际货币基金组织特别提款权(SDR)里头的第三大权重货币,占比10.9%。而全球人民币外汇储备占比仅为2%出头,明显偏低。但实际上,SDR的五种权重货币中,只有美元外汇储备的占比超过了它的权重。SDR的篮子货币权重分别为美元42%、欧元31%、人民币11%、日元和英镑都是8%多一点。对应的全球外汇储备中,美元占比50%稍弱,欧元20%出头,日元和英镑分别不到6%和5%。为什么会这样呢?值得大家深刻思考。', '  这反映了国际货币体系存在路径依赖、网络效应。老的国际化货币,大家用得多以后,形成了习惯。用的越多、交易成本就越低。而且,交易习惯一旦形成以后,除非有大的冲击,大家不会随便改变交易习惯。在很多货币国际化的指标里头,美元、欧元、日元和英镑的权重合计都在90%左右。其中,排名一二的美元和欧元权重都是两位数,第三四名才个位数,根本不是一回事。', '  为什么美元能有超过经济影响力的权重呢?我觉得很重要原因美元资产拥有一个最有深度广度和流动性的市场,大家持有美元资产的交易成本非常低非常便利持有。', '  再有一个原因就是大部分国际化货币当地金融开放程度比较高。这方面有三个重要标志,一是资金自由进出,二是货币自由兑换,三是汇率自由浮动。在国际货币基金组织披露币种构成的八种储备货币中,除人民币意外,其他货币都是这种情形。', '  因此,同中国的经济潜力相比,人民币国际化仍有追赶空间,但与金融市场的开放程度、发育程度、监管水平相比,人民币国际化的现状是与客观现实相适应的。', '  十四五规划提出要稳慎推进人民币国际化。我觉得,下一步要从以下七个方面着手推进人民币国际化:', '  第一个加快构建新发展格局,通过供给侧改革和高水平开放实现高质量发展。因为新常态下,中国经济增长速度下行可能是大势所趋,经济体量这么大了,不可能像以前那么高的增长。这种情况下,要从过去追求经济增长速度转向经济增长的质量。经济强货币强。只有把经济搞好了,货币国际化才能行稳致远,更好地走出国门。', '  第二个加快国内金融市场发展。目前,中国债市、股市和期货市场在全球都是名列前茅,但是普遍存在大而不强的问题。要按照市场化、法治化、国际化的要求,发展有深度广度、有流动性的金融市场,才能更好便利境外投资者人民币资产配置。特别是境内外汇市场,我们连大都说不上,人民币明前还只是全球第八大外汇交易货币。这与人民币国际化的潜力不太相称。', '  第三个是提高对外金融开放水平。要从过去的商品和要素流动性开放转向制度性开放。短期来讲,我们的开放尽可能稳中求进,避免政策的反复。我跟陈总观点有点差异,他觉得可以快,我觉得不要为了开放而开放,不要操之过急,将来出了问题又往回退。另外,要提高法律层次,形成一个稳定的、可预期的制度环境,稳定投资者的信心。从中长期来看,则是要和国际最高标准就是负面清单管理接轨。走到这一步,才是国际上真正接受和认可的金融开放。', '  第四个是加快构建现代财税金融体系,提高宏观调控效率,促进经济健康平稳发展,同时提高政策透明度和公信力,保持人民币的实际购买力,增强人民币资产的国际吸引力。人家为什么选择持有人民币资产?肯定要有不一样的地方。现在全球主要央行都在搞非常规货币政策,我们在尽可能坚持正常的宏观政策,保持人民币资产的正收益,这对人民币在国际货币体系中脱颖而出会有很大帮助。', '  第五个是还应该有一个差异化,即在人民币走出国门的过程中,通过制度建设和基础设施完善,为人民币跨境流通使用创造更加便捷、低成本的,更加市场友好型的环境。', '  第六个是坚持创新发展,加快转变外贸发展方式,从以价取胜转向以质取胜。跨境人民币业务的试点是从贸易开始的,在政策上是鼓励的。但到目前为止,跨境贸易用人民币计价结算占比不到15%,85%以上是外币计价结算,外币计价结算中九成以上是用美元。这不是我们的政策上有障碍,很重要的一个原因是国内企业没有议价能力,缺乏定价权。比如,去年我国不仅经济正增长,外贸也是正增长,今年外贸出口继续超预期增长。但在全球买中国的情况下,从海关的数据来看,今年前四个月我国贸易条件却是恶化的,进口价格指数同比上涨,出口价格指数稳中有价。这反映了国内企业在全球产业链供应链上的定价能力不足,影响了用本币计价结算。', '  最后一个是按照“十四五”规划提出来的,提高开放条件下的风险防范和应对能力,完善跨境资本流动监管手段,从过去的行政审批、数量控制为主转向宏微观审慎措施相结合为主。同时,还要加强国际收支流量和存量的统计监测。']"
97,2021年07月26日 07:19,在线教育独角兽被挡上市门外 职业教育或成下一行业风口,"['  原标题:在线教育独角兽被挡上市门外职业教育或成下一行业风口', '  来源:长江商报', '  长江商报记者陈妮希实习生杨思宁', '  冰火两重天,可谓是在线教育行业近一年的真实写照。', '  去年疫情催热在线经济发展,在线教育行业被按下“快进键”,高额投资资金纷纷涌入在线教育领域。相关数据统计,2020年,中国在线教育领域投融资事件共111起,总金额高达539.3亿元。与此同时,包括一起教育等在线教育行业掀起上市热潮,成为当年最受热捧的行业之一。', '  仅过去一年,今年四月,北京市场监管局对跟谁学、新东方在线、学而思、高思四家校外教育培训机构,因价格违法、虚假宣传等行为分别给予警告和50万元顶格罚款的行政处罚。彼时,业内分析认为,此举意味着在线教育或将进入强监管时代,这对无线扩张的在线教育平台,起到了收缩作用,同时估值也将大打折扣。', '  7月24日,为持续规范校外培训(包括线上培训和线下培训),有效减轻义务教育阶段学生过重作业负担和校外培训负担(简称“双减”),中共中央办公厅、国务院办公厅印发了《关于进一步减轻义务教育阶段学生作业负担和校外培训负担的意见》(简称《意见》),明确学科类培训机构一律不得上市融资,严禁资本化运作。各地不再审批新的面向义务教育阶段学生的学科类校外培训机构,现有学科类培训机构统一登记为非营利性机构。', '  受此消息影响,教育股集体大跌,超20只教育股跌超20%。在港股市场中,新东方跌幅达56.89%,新东方在线股价跌28.07%,思考乐教育跌28.53%,卓越教育集团跌21.48%。在美股市场,好未来开盘后一度临时停牌,停牌前跌幅也超过五成;截至收盘,好未来股价报6.06美元,跌70.47%;高途股价报3.51美元,跌63.36%。', '  除了上市公司之外,一批教育行业独角兽也被挡在上市门外。对于,业内分析认为,教育培训行业将会进入一轮深入洗牌期,一批上市培训教育上市公司将被清理,独角兽企业上市梦碎,小型机构或私人培训班也将面临淘汰。', '  行业加速进入一场深度洗牌', '  《意见》指出,学科类培训机构一律不得上市融资,严禁资本化运作;上市公司不得通过股票市场融资投资学科类培训机构,不得通过发行股份或支付现金等方式购买学科类培训机构资产;外资不得通过兼并收购、受托经营、加盟连锁、利用可变利益实体等方式控股或参股学科类培训机构。已违规的,要进行清理整治。', '  对原备案的线上学科类培训机构,改为审批制。各省(自治区、直辖市)要对已备案的线上学科类培训机构全面排查,并按标准重新办理审批手续。未通过审批的,取消原有备案登记和互联网信息服务业务经营许可证(ICP)。对非学科类培训机构,各地要区分体育、文化艺术、科技等类别,明确相应主管部门,分类制定标准、严格审批。依法依规严肃查处不具备相应资质条件、未经审批多址开展培训的校外培训机构。', '  《意见》明确,坚持政府主导、多方联动,强化政府统筹,落实部门职责,发挥学校主体作用,健全保障政策,明确家校社协同责任;坚持统筹推进、稳步实施,全面落实国家关于减轻学生过重学业负担有关规定,对重点难点问题先行试点,积极推广典型经验,确保“双减”工作平稳有序。', '  教育部门要抓好统筹协调,会同有关部门加强对校外培训机构日常监管,指导学校做好“双减”有关工作。人民银行、银保监、证监部门负责指导银行等机构做好校外培训机构预收费风险管控工作,清理整顿培训机构融资、上市等行为。', '  “双减”文件的覆盖面不仅限于K12学科培训,还提及,“不得开展面向学龄前儿童的线上培训,严禁以学前班、幼小衔接班、思维训练班等名义面向学龄前儿童开展线下学科类(含外语)培训”,意味着0-6岁的校外培训也将被严格监管,整个行业势必要进行一场深度洗牌。', '  在线教育独角兽被挡上市门外', '  长江商报记者注意到,此前IT桔子正式发布‘2020年中国新经济教育独角兽’行业榜单显示,目前中国估值最高的教育公司是猿辅导——也是全球估值最高的教育独角兽,估值近155亿美元;作业帮的投后估值约72.5亿美金,位列第二;VIPKID估值位列第三,达到45亿美元;掌门一对一在去年9月完成新的4亿美元融资后,估值攀升到40亿美元,位列第四;其余9家估值都在10~20亿美元之间。', '  从细分领域来看,中国教育独角兽公司以在线K12教育占主导,有10家,还有2家职业培训独角兽公司——高顿教育和慧科教育集团。众所周知,K12教育是目前教育细分领域中最大的市场,具有时间跨度长、连贯性、课外培训等特征,而资本青睐于能够实现规模化的在线教育公司,而K12教育主要针对的就是学科类培训机构,这意味着中国教育独角兽主要力量均被挡在上市门外。', '  曾经被资本“催熟”的K12在线教育,如今正面临着转型、深度洗牌。行业分析认为,关闭K12赛道,目前成了投资人们的普遍选择,如果继续关注教育,也是将目光放在素质教育、职业教育等受政策监管影响较小的领域。', '  在资本与政策的双重加持下,职业教育领域或将成为在线教育行业的下一个风口。近段时间高途也将职业教育作为又一品牌主线;猿辅导旗下斑马探索教育硬件,发布了斑马思维学习机......对于教育企业而言,一个时代的落幕,意味着另一个时代的开启。', ' ']"
98,2021年07月26日 10:54,快讯：三大指数震荡下挫创指跌逾2% 农业种植板块异动拉升,"['  炒股就看金麒麟分析师研报,权威,专业,及时,全面,助您挖掘潜力主题机会!', '  7月26日消息,三大指数集体低开,低开后震荡下挫,沪指失守3500点,创指跌逾2%,上证50指数跌超2.5%,北向资金净流出达50亿元。板块方面,半导体芯片板块走高,农业种植板块异动拉升。总体而言,市场避险情绪较强,个股跌多涨少,赚钱效应较差。截至发稿,沪指跌1.64%,报3492.29点;深成指跌1.76%,报14763.94点;创指跌2.01%,报3400.28点。', '  从盘面上看,有色、半导体、国防军工涨幅居前,云游戏、白酒概念、医美概念板块跌幅居前。']"
99,2021年07月22日 17:54,2分钟读财报 | 被爆训练记录造假和安全隐患 华夏航空已涉信披违规?,"['  7月12日,华夏航空跌停登上龙虎榜,当天前五大卖出席位均为机构专用,合计净卖出超1亿元;7月13日再次跌停收盘,有两家机构买入的同时,仍有三家机构选择卖出,净卖出5801万元。两天时间内,机构合计净卖出达1.6亿元。', '  实际上,在大跌发生前,航空圈内就已出现公司相关的利空消息。', '  根据“民航观察”的梳理,7月7日晚,华夏航空内部发了通告:从7月8日起,提高了CRJ900的运行标准。特别明确了CRJ900机型除重庆江北、贵阳龙洞堡、成都双流、天津滨海、西安咸阳、呼和浩特白塔机场外,其他机场不得执行夜航。', '  7月8日,一则关于华夏航空“7月5日在延安发生不安全事件”的消息在网络传播开来;同天,华夏航空的执行航班量环比前两天出现了近30%的大幅异常下滑。', '  而更早之前,今年6月11日,民航局召开党组理论学习中心组第四次集体学习暨月度安全运行形势分析会,会上局长冯正霖点名批评了包括华夏航空在内的四家单位。', '  若上述内容属实,华夏航空无疑存在严重的管理问题和安全隐患。', '  然而,作为一家航空公司,尽管从现有信息看已出现了事关飞行安全方面的问题,并影响到了执飞航班等日常经营,但直到目前,公司仍未给出任何解释和说明。', '2分钟读财报|业绩不够、卖企鹅来凑?大连圣亚终究没逃过被*ST的命运', '2分钟读财报|盈利能力受质疑首日涨19倍的读客文化能走远吗', '2分钟读财报|业绩暴雷连续3跌停盐津铺子实控人紧急出手了']"
100,2021年07月23日 16:26,ST网力索赔案一审开庭 律师：三日一价达成一致意见 索赔情况乐观,"['  受损股民可至新浪股民维权平台登记该公司维权:http://wq.finance.sina.com.cn/', '  关注@新浪证券、微信关注新浪券商基金、百度搜索新浪股民维权、访问新浪财经客户端、新浪财经首页都能找到我们!', '  2020年11月30日,ST网力(维权)收到证监会《行政处罚决定书》,查明了其三年违规担保额高达14.19亿,除此还存在重大合同不披露的违法事实。行政处罚的落地按下了股民索赔的“启动键”,近日,投资者诉ST网力虚假陈述民事索赔案有了最新进展,北京金融法院一审开庭审理了ST网力投资者索赔案件。(ST网力维权入口)', '  据参与庭审的上海国瓴律师事务所薛天鸿律师介绍,庭审中,原被告双方对于三日一价(揭露日、实施日、基准日及基准价)的认定达成了一致意见,但双方在赔偿比例上出现分歧,东方网力认为投资者损失部分是由于市场因素导致,和上市公司违规行为无关。', '  三年瞒报十多亿元对外担保及重大合同', '  回溯过往,早在2019年9月20日,彼时还为东方网力的该公司自曝违规,公司发布《关于公司自查涉及违规担保、资金占用事项的公告》表示,自查发现累计存在的违规担保金额共计16亿元(已偿还2.5亿元,剩余未偿还违规担保总额13.5亿元),并存在2.25亿元的资金占用情形,导致上市公司被起诉、公司的银行账户被冻结。', '  2020年4月15日,东方网力公告收到《调查通知书》,宣布因公司涉嫌信息披露违法违规,公司及原控股股东、现董事刘光被中国证监会立案调查。', '  随后,历经半年多调查,东方网力及刘光涉嫌信披违法违规一案的处理结果最终落槌。2020年11月30日,证监会查明,ST网力存在未按规定披露对外担保事项及未按规定披露重大合同的违法事实。', '  具体来看,2017年4月至2019年3月,东方网力为北京维斯可尔科技发展有限责任公司等5家公司的借款提供担保、为北京市警视达机电设备研究所有限公司等4家公司的应收账款保理融资提供担保。', '  东方网力上述对外担保事项在2017年至2019年的发生额分别为45,031万元、74,100万元和22,736.07万元,分别占东方网力2017年年报、2018年年报和2019年年末经审计净资产的12.24%、18.53%和29.83%,然而,东方网力未按规定及时披露上述对外担保事项。', '  此外,2017年4月21日,东方网力签署《平安财富*铂金10号集合资金信托计划信托合同之补充协议》,约定东方网力作为劣后级委托人认购信托单位的资金预计为6,300万元。同日,东方网力与中信国安(维权)(深圳)基金管理有限公司(以下简称国安深圳)签署《回购协议》,约定东方网力有义务按照国安深圳的书面要求于投资期限届满之日起10个工作日内受让标的信托单位,并足额支付标的信托单位转让价款。《回购协议》约定的回购金额最高可达56,700万元,占东方网力2017年年报经审计净资产的15.68%,然而,东方网力也未按规定在2017年年报中披露上述《回购协议》。', '  律师:未来投资者索赔情况较为乐观', '  随着证监会正式处罚下达,股民的索赔案件也正式启动。今年6月8日,ST网力发布重大诉讼公告,其中披露投资者索赔的涉讼总额3918.24万元。', '  如今,投资者诉ST网力虚假陈述民事索赔案在北京金融法院一审开庭,薛天鸿律师指出,法院对于本案的关注点集中在东方网力虚假行为与投资者的损失之间的因果联系占比上,即考虑系统性风险对于投资差额损失的影响及占比。为此,东方网力提供了大量年报财报、公司利空公告、媒体负面舆论以证明在实施日至揭露日期间,乃至揭露日后公司出现大量利空消息,公司的股价下跌是由于系统及非系统性风险导致。', '  此外,薛天鸿律师表示,本次庭审是东方网力证券虚假陈述行为引发的相关案件的首次正式开庭,故法院仅就原被告双方的基础法律关系和核心争议焦点进行了讨论,对于与赔付最终相关的其他细节尚未作进一步讨论,后续是否需要进行第二次开庭将根据法院的安排处理。', '  不过,薛天鸿律师称,未来投资者索赔情况较为乐观,符合索赔条件的投资者获赔可能较大,现继续向广大ST网力的投资者展开征集,索赔条件为:在2018年4月25日至2019年9月20日之间买入ST网力,且在2019年9月21日之后卖出或持有ST网力的亏损投资者。', '  (本文观点提供律师:上海国瓴律师事务所合伙人薛天鸿律师,不代表新浪财经观点。薛天鸿律师,上海国瓴律师事务所首席合伙人,主任,资深律师。上海律师专业水平评审委员会评定的首批公司法专业律师、上海市闵行区十大“优秀律师”、中证中小投资者服务中心公益调解员。拥有十年以上法律服务经验,拥有丰富的金融证券相关诉讼业务实战经验)']"
101,2021年07月26日 07:17,河北衡水中学：网传在美上市、进军深圳等内容严重失实,"['  炒股就看金麒麟分析师研报,权威,专业,及时,全面,助您挖掘潜力主题机会!', '  严正声明', '  近期,网上发布的第一高中教育集团在美上市、衡水中学在美上市、衡水中学进军深圳、深圳衡中文化教育培训有限公司招收高考复读生等信息,涉及我校的内容严重失实,误导了社会公众,侵犯了学校合法权益,在社会上造成了不良影响。为此,严正声明如下:', '  1.我校与近期网络媒体传播热议的第一高中教育集团在美上市、衡水中学在美上市、衡水中学进军深圳、深圳衡中文化教育培训有限公司招收高考复读生等信息均无任何关系,更未授权相关集团、公司及其关联学校、培训机构以我校名义从事教育、招生及商业等活动。', '  2.衡水中学是衡水市政府举办的公办高中,依法独立享有“衡水中学”名称、“衡中”简称的名称权,未经授权,任何组织和个人不得使用我校的名称,或以我校的名义开展相关活动。关于衡水中学的信息,均以衡水中学官方平台(官方微信账号:hbhszxgfwx;官方网址:http://www.hbhszx.cn/#/)发布的信息为准。', '  3.对于擅自使用“衡水中学”名称、“衡中”简称,进行虚假宣传,以及在各大网络平台上发布、传播有关我校不实信息的行为,构成侵权的,将依法追究其法律责任。', '  特此声明。', '  河北衡水中学', '  2021年7月25日', '  来源河北衡水中学微信公众号', '  编辑曾佳佳', '  流程编辑吴越']"
102,2021年07月26日 09:32,东方证券盘中快速上涨,"['  07月26日消息,东方证券盘中直线拉升快速上涨,截止09:32,报价12.64元,涨幅1.85%,成交221582手,成交量2.74亿元,换手率0.39%。', '  资金流向方面,呈现主力资金净流出状态,特大单买入0.7087亿元,占比27.45%,卖出0.6294亿元,占比24.38%;大单买入0.8016亿元,占比31.05%,卖出0.8951亿元,占比34.67%。']"
103,2021年07月26日 09:32,中炬高新大涨,"['  07月26日消息,中炬高新大涨,截止09:32,报价39.75元,涨幅5.3%,成交54711手,成交量2.14亿元,换手率0.69%。', '  资金流向方面,呈现主力资金净流出状态,特大单买入0.5164亿元,占比25.69%,卖出0.7031亿元,占比34.97%;大单买入0.6334亿元,占比31.5%,卖出0.5502亿元,占比27.37%。']"
