,Publish Time,Title,Article
0,2021年07月26日 07:30,【安踏体育*吴劲草】深度：中国的安踏，世界的安踏，国潮崛起下再攀高峰,"['', '', '安踏体育(02020)', '中国的安踏,世界的安踏', '国潮崛起下再攀高峰', '投资要点', '少有的多品牌矩阵运动鞋服集团,运营能力突出:安踏品牌源于1991年,创始人自身对于运动产业理解深刻,整个管理层具备丰富的经验且数十年稳定不变,目标一致,配合默契程度高,执行力强。运动鞋服作为功能性鞋服的一种,本身品牌的文化认同和功能区分度高,品牌粘性强,易诞生穿越周期的大品牌,基于此再做时尚性的延伸,树立立体化的品牌形象。我们从公司过去30年的发展也可看到这一点。正是因为行业生意属性好,叠加公司扎实的管理运营能力,安踏才能成长成收入过350亿元,市值超过4000亿港币的综合运动品牌集团。', '二次腾飞:收购FILA是安踏向综合型运动品牌运营商迈进的重要转折点。FILA本身自带意大利品牌血统和时尚元素,能让消费者更容易买单,同时又契合了日渐兴起的时尚运动风潮,叠加安踏本来就深谙中国消费者心理,有扎实的渠道优势和管理经验,成功帮助FILA获得重生,同时也为安踏培育其他更多优质品牌积累了丰富的经验。2020年FILA收入占比已经近50%,达到174.5亿元。', '国潮崛起:“新疆棉”只是开始,国牌长期市占率仍有提升空间。国潮崛起背后的根本来自于在我国成熟的供应链体系下,产品力的不断提升,多样的营销和渠道助推,以及95后和00后对国产品牌的评价体系更加客观(文化自信),是综合国力的提升和个人认知到一定阶段自然发生的一个认知的集合体现,“新疆棉”只是一个开端,未来国潮崛起会持续,国内市场销售额占比有望向头部15%-20%的水平看齐。', '新的增长曲线:高端运动户外品牌。我国户外高端品牌现阶段更多满足的还是消费者对于更高端运动品牌的诉求,而非仅仅为了户外。在整个价格带提升的逻辑下,我们认为公司旗下的高端运动户外品牌如迪桑特,KOLON,始祖鸟和Salomon等均具备较大的增长空间。2020年,迪桑特收入已过15亿元,线下门店接近200家,未来有望成长为收入50亿元+ 的大品牌。而KOLON,始祖鸟和Salomon等也有100多家门店,未来增长潜力同样较大。', '盈利预测与投资评级:我们预计公司未来增长主要来自于:1)国货崛起推动安踏主品牌增长;2)FILA作为时尚运动品牌的龙头,单店销量,店铺数量仍有拓展提升空间,尤其是其FILAfusion等子系列;3)迪桑特自2019年开始盈利以来变保持着良好的增长势头且可持续,未来有望成为收入50亿元+大品牌;4)Amer盈利改善,长期增长逻辑扎实,未来可期。我们预计公司2021-2023年将实现归母净利润79亿/102亿/123亿元,首次覆盖,给予“买入”评级。', '风险提示:消费景气度下降,Amer整合和DTC改革推进不及预期。', '(分析师吴劲草)', '', '', '', '', '', '', '', '', '', '', '', '', '', '']"
1,2021年07月23日 14:53,珍酒：昔日茅台异地试验项目 如今仅列第三梯队,"['  炒股就看金麒麟分析师研报,权威,专业,及时,全面,助您挖掘潜力主题机会!', '  按照营收规模,酱酒企业可以分成四个梯队,第一梯队是茅台酒,营收超过900亿;第二梯队是习酒和郎酒,营收在100亿左右;第三梯队是营收在10亿-50亿元之间的酒企,包括了国台、金沙、珍酒、钓鱼台;第四梯队则是营收10亿元下的小酒企。', '  随着酱酒热的持续升温,酱酒企业也开始了资本运作,不少小酒企选择被并购或者与上市公司合作,大中型酒企则在准备独立IPO。目前第二梯队的郎酒和第三梯队的国台已经披露招股书,有些已经列入政府上市后备名单。新浪财经上市公司研究院浪头饮食特推出系列策划,解读第三梯队酱酒企业。', '  珍酒2020年营收接近20亿元,产能略低于国台。按照80%的增长目标,2021年珍酒销售收入将达到36亿元。', '  珍酒:茅台易地试验项目产物2025年产能将达到3.5万吨', '  珍酒是1975年“贵州茅台酒易地生产试验(中试)项目”中诞生的酒企。', '  当时国家提出了将茅台产量扩大到1万吨的目标,1975年原茅台厂长郑光先率领28名技术骨干和全国各地抽调的精英开启了试验项目。', '  选址在距离茅台镇仅130公里,气候条件相似的遵义市北郊。为了做到完全复制茅台,将窖石、窖泥、原料、设备,甚至茅台酒厂附近的土都原封不动搬了过来。经过十年时间,酿出的酒最终被鉴定为“色清,微黄透明,酱香突出,幽雅,酒体较醇厚......基本具有茅台酒风格。”', '  1986年,“贵州茅台酒易地生产试验厂”改名为“贵州珍酒厂”独立运营,珍酒正式诞生。1990年左右,珍酒产量约为500吨,茅台则为1300吨。', '  从1995年开始,珍酒盲目借贷,扩建了1000吨产量的厂房,恰逢白酒行业低迷期到来,珍酒厂差点破产,最终于2009年被金东集团(原华泽集团)全资收购,更名为贵州珍酒酿酒有限公司。', '  金东集团入主后,不断投资扩产。官网信息显示,目前珍酒具备酿酒1万吨、制曲2.2万吨、包装产能1万吨的生产规模,酒厂库存优质酱香老酒达2万多吨。根据管理层在“贵州珍酒2020年度合伙人大会”上透露的信息,2021年珍酒新增产能1万吨,到2025年产能将达到3.5万吨。', '  “十四五”期间珍酒拟投入300亿元用于珍酒厂原址扩产项目、汇川区永胜村酿酒项目、金东酱酒园项目,全部建成投产后,将形成酿酒7.5万吨,储酒35万吨的规模。', '  值得注意的是,在政府支持下,主要酱酒企业纷纷提出扩产能计划。根据酒业家及权图酱酒工作室发布的《2020-2021中国酱酒产业发展报告》,2020年整个酱酒行业产能约为60万吨,而这几年增加的产能约在20万吨左右,从2023年开始将陆续进入市场。相当于未来几年在现有产能基础上将增加超过30%的产能。届时大力扩产能的中小玩家是会乘势崛起还是归于没落,都还是未知数。', '  销售额在20亿左右今年计划增长80%', '  珍酒核心产品为珍15,售价在500元左右,处在次高端价格带。此外还有高端产品珍30,售价1600左右。', '  据珍酒销售公司总经理郭亮在“贵州珍酒2020年度合伙人大会”上透露的信息,2020年1-11月,珍酒销售同比增长67%,珍15及以上产品销售贡献占比达到了54%,经销商数量接近1000家,包含城市合伙人、体验馆合伙人、OEM三类合作商家在内。', '  管理层提出的目标是,2021年保持80%的增长,以20亿的规模算,2021年营收规模将达到36亿元。', '  据媒体报道,今年仍保持高速增长,一季度销售额达到了15亿元。在开年实现开门红后,珍酒紧接着就对旗下产品进行提价。', '  2021年3月15日,珍酒发布《关于调整珍酒产品价格体系的通知》,宣布3月15日起对珍酒产品进行提价,距离上次提价仅过去半年。', '  作为万吨产能的酒企,珍酒是酱酒第三梯队中重要的酒企。在这一轮酱酒热中,珍酒能否成功塑造品牌力,销售上能否跨过50亿门槛,都值得关注。']"
2,2021年07月23日 14:55,钓鱼台酒业：渠道是最大短板 不扩产恐掉队,"['  按照营收规模,酱酒企业可以分成四个梯队,第一梯队是茅台酒,营收超过900亿;第二梯队是习酒和郎酒,营收在100亿左右;第三梯队是营收在10亿-50亿元之间的酒企,包括了国台、金沙、珍酒、钓鱼台;第四梯队则是营收10亿元下的小酒企。', '  随着酱酒热的持续升温,酱酒企业也开始了资本运作,不少小酒企选择被并购或者与上市公司合作,大中型酒企则在准备独立IPO。目前第二梯队的郎酒和第三梯队的国台已经披露招股书,企业有些已经列入政府上市后备名单。新浪财经上市公司研究院浪头饮食特推出系列策划,解读第三梯队酱酒企业。', '  钓鱼台酒业2020年销售额在10亿元左右,是第三梯队中排名第四的酒企。与其他酒企不一样,钓鱼台目前并没有扩产计划。由于历史原因,钓鱼台没有销售团队,渠道比较薄弱,目前还处在转型期。在这一轮酱酒热中,第三梯队的钓鱼台能走多远?', '  钓鱼台酒业:2017年才开始对外销售目前规模10亿左右', '  钓鱼台酒业全称为“贵州钓鱼台国宾酒业有限公司”,位于仁怀市茅台镇,酒厂始建于1999年,由北京钓鱼台国宾馆投资建设。建厂初衷是提供高品质高性价比的纯正酱香型白酒用于国宾宴请、国礼馈赠。', '  根据天眼查信息,目前钓鱼台经济开发公司持有钓鱼台酒业43%股份,钓鱼台经济开发公司是外交部钓鱼台宾馆管理局全资子公司;此外还有三名自然人股东,丁怀远持有36%股份,安怀略持有16%的股份,李太国持有近5%的股份。', '  钓鱼台酒业成立后几乎没有销售团队,生产的钓鱼台酒也不对外销售,整个公司就是一个大的生产车间,生产的白酒全部发货给北京钓鱼台酒业公司销售。相当于一家定制酒公司。', '  从2017年4月开始,钓鱼台酒才真正开始面向市场销售,2018年销售额为8亿元,同比增长100%。2017年以前,公司以国宾酒为主导,贵宾酒为补充,每年销量不超过300吨。', '  钓鱼台采用专销商定制模式开拓市场,包装设计、营销方案等都交给专销商负责,钓鱼台对专销商掌控力比较弱。专销酒销量占比在90%以上。', '  目前钓鱼台渠道销售有两个,分别是专销商和钓鱼台国宾馆酒店,核心产品有两款钓鱼台国宾,售价558元;钓鱼台贵宾,售价468元。', '  2019年钓鱼台开始提高专销商门槛,2019年收回专销条码60多个,2020年再收回30个以上。', '  保持3000吨产能不扩产目前还在转型阶段', '  钓鱼台在茅台镇拥有160亩生产厂区,具备3000吨酱酒的生产能力。', '  公司的整体战略是维持3000吨的产能,不扩产。总经理丁远怀2020年7月曾对媒体表示,“3000吨是一个非常适中的规模,我们产业工人有800多人,我们还要把投入花在生产管理、基酒储备、质量控制、市场布局、体系建设和售后服务这些工作上,还要做得更完美,把市场夯实得刚好。”', '  3000吨产能在酱酒第三梯队中是比较小的,珍酒目前产能为5000吨,国台为8000吨,金沙则达到1.9万吨。随着这几家公司扩产能计划的开展,产能差距会进一步扩大。', '  目前的钓鱼台整体还处在转型阶段,2017年以来依靠专销商模式获得快速增长,这也带来了品牌众多的问题,最多时用于100多个条码。', '  今年丁远怀面对媒体曾表示,今后要开始转型,“在5年之内,以钓鱼台国宾酒为代表的自营产品要占公司整体销售量50%以上。”']"
3,2021年07月23日 19:43,社保基金会再减持中国人保：拟六个月内减持A股不超过约8.84亿股,"['  自本公告之日起15个交易日后的六个月内减持中国人保无限售条件A股不超过8.84亿股,即不超过中国人保当前已发行股份总数的2%。', '  7月23日晚间,中国人民保险集团股份有限公司(下称中国人保)发布公告称,根据全国社会保障基金资产配置和投资业务需要,全国社会保障基金理事会(下称社保基金会)计划通过集中竞价或大宗交易方式,自本公告之日起15个交易日后的六个月内减持中国人保无限售条件A股不超过8.84亿股,即不超过中国人保当前已发行股份总数的2%,该部分股份来源于2011年6月战略入股。减持价格视二级市场价格确定。', '  本次减持计划是社保基金会常规性投资业务安排。中国人保公告称,股份减持交易将由社保基金会所委托的减持管理人负责实施,可通过集中竞价或大宗交易方式减持,减持股份的数量和价格亦存在不确定性。', '  社保基金会是财政部管理的事业单位,其管理运营的全国社会保障基金是国家社会保障储备基金,由中央财政预算拨款、国有资本划转、基金投资收益和国务院批准的其他方式筹集的资金构成,专门用于人口老龄化高峰时期的养老保险等社会保障支出的补充、调剂。', '  公告显示,2011年6月,中国人保引入社保基金会作为战略投资者,社保基金会认购中国人保3,891,050,583股股份。此后,社保基金会通过接受国有资本划转、二级市场交易等方式,累计增加持股2,947,245,744股股份。', '  2020年7月,社保基金会曾按照证券监管规则,披露为期六个月减持不超过公司已发行股份总数的2%的股份减持计划。在该计划有效期内(2020年7月31日至2021年1月30日),社保基金会通过委托的证券公司以集中竞价方式累计减持A股477,817,648股,占公司已发行总股本的1.0804%。', '  截至2021年6月末,社保基金会仍为中国人保第二大股东,合计持有中国人保A股和H股共6,838,296,327股,约占公司当前已发行股份总数的15.46%。']"
4,2021年07月23日 15:03,1545亿资金争夺20股：主力资金重点出击4股(名单),"['  7月23日消息,A股三大指数全线低开,钢铁股开盘活跃。盘中指数震荡下挫,创指失守3500点,CRO概念、医疗器械、基因测序等医药股集体回调,白酒、旅游、饮料、家电、食品等消费股重创,鸿蒙、数字货币、造纸板块走弱;煤炭、黄金、稀土等资源类周期股逆势上涨,汽车、证券、半导体、HIT电池活跃。午后指数低位盘整,军工股掀涨停潮,农业种植、光伏板块先后拉升。总体来看,市场情绪依旧低迷,前期热门题材全面回调,两市逾3100个股下跌,成交额再次突破1.3万亿元。', '  具体看,截止收盘,沪指报3550.40点,跌0.68%,成交额为6042亿元(上一交易日成交额为5668亿元);深成指报15028.57点,跌1.53%,成交额为7745亿元(上一交易日成交额为7341亿元);创指报3469.87点,跌2.10%,成交额为3218亿元(上一交易日成交额为3096亿元)。 ', '  统计显示,TOP20的股票成交额超1545亿元,根据新浪财经leve2资金流向图显示,在这20只股票中,有4只股票呈现主力资金流入,其中,比亚迪主力流入净额超13亿元;格林美主力流入净额超5亿元;航发动力、士兰微主力流入净额不足1亿元。', '  另有16只股票呈现主力资金净流出,其中,中远海控主力流出净额超20亿元;京东方A主力流出净额超17亿元;东方财富主力流出净额超12亿元;宝钢股份主力流出净额超11亿元;北方稀土主力流出净额超9亿元;五粮液主力流出净额超8亿元;赣锋锂业主力流出净额超7亿元;贵州茅台主力流出净额超6亿元;片仔癀主力流出净额超5亿元;多氟多、三安光电、天齐锂业主力流出净额超3亿元;三一重工、隆基股份主力流出净额超2亿元;江特电机、宁德时代主力流出净额不足1亿元。']"
