,Publish Time,Title,Article
49,2021年07月25日 23:07,教育股腰斩博时全球中国教育踩雷 基民彻夜难眠：下周一是否会跌停？,"['  原标题:教育股经历腰斩博时全球中国教育踩雷教育股基民彻夜难眠:下周一是否会跌停?', '  来源:洞见财经研究室', '  美国当地时间7月23日,美股三大股指齐齐创出新高,纳指创逾3月最大周涨幅。然而,与美国股指形成巨大反差的中概教育股,当日却深陷崩盘的境地,受政策利空影响,曾经的教育界三巨头股价受重挫,好未来暴跌70.47%,高途集团跌63.36%,新东方跌54.22%。', '  据悉,当天,好未来市值蒸发93.62亿美元,约合607亿人民币。高途市值蒸发15.54亿美元,约合100亿人民币。新东方市值蒸发59.49亿美元,约合385亿人民币。7月23日,三家公司市值在共蒸发1092亿人民币。伴随着相关股票的大幅下挫,记者也回想起刚发行两个月不到的博时全球中国教育ETF。', '  教育股遭遇滑铁卢', '  7月24日,中共中央办公厅、国务院办公厅印发《关于进一步减轻义务教育阶段学生作业负担和校外培训负担的意见》。意见指出,人民银行、银保监、证监部门负责指导银行等机构做好校外培训机构预收费风险管控工作,清理整顿培训机构融资、上市等行为;其他相关部门按照各自职责负起责任、抓好落实。', '  在监管风暴之下,中国教育培训行业的泡沫正在破裂。7月23日,港股教育股集体重挫,新东方在港股上市股价一度跌幅达50%,创造历史最大单日跌幅,卓越教育集团跌超20%,思考乐教育一度跌近30%。以此同时,隔夜美股市场的教育股也全部崩盘。', '  不仅好未来、高途教育、新东方股价大幅回落,而且网易有道跌超40%,一起教育跌近40%,流利说跌超近27%,尚德机构跌超10%。其实,这已经不是中概教育股首次遭遇集体重创。以好未来为例,自今年2月以90.96美元创历史新高以来,至今跌幅超93.45%。', '  其实,此次政策落地并非空穴来风,国家对校外培训行业的整治早已开始。6月15日,国家教育部正式宣布,经中央批准,正式成立校外教育培训监管司。6月17日,人口大省山东已经打响了第一枪,山东教育局印发《关于做好中小学生暑假学习生活安排的通知》,其中明文禁止:各类机构不得以任何形式参与、组织学生参加辅导培训班,禁止学校联合或将校舍租借给社会机构用于开办补习班、培训班。', '  从政策导向来看,校外培训行业已经大势已去,部分教育培训机构甚至出现裁员潮,正当产业风声鹤唳之时,这只基金却准备大举抄底中概教育股。对此,业内人士普遍质疑,现在抄底的策略是否合适?6月8日,博时全球中国教育基金成立,原本计划大举抄底,谁曾想成立不足两个月的时间,几乎一直处于亏损状态。', '  从截图的内容来看,自该基金上市后,一直处于亏损状态。截止7月24日,该基金最新净值为0.827。这意味着,只要有人买了这基金,从买入便陷入亏损,其盈利能力堪忧。据了解,这只基金指数选取的,50只流动性较好、市值较大的教育主题证券,其中包括纽交所上市的新东方教育,深交所的视源股份和港交所的中教控股(00839)等。', '  6月17日,博时中证全球中国教育ETF在上交所上市交易,作为国内首只教育ETF,上市首日收于0.9016元/份,跌9.85%,距离跌停板仅一线之隔。上市交易日就跌停,其原因也是由于6月15日的一纸公告,当时正值教育部校外教育培训监管司宣布成立。', '  受此政策影响,随后的两个交易日,港美股市场在线教育股持续下挫。好未来跌16.92%、高途跌12.51%、新东方跌12.26%。6月18日港股,天立教育(01773)跌20.98%、思考乐教育(01769.HK)跌10.99%,这些暴跌的中概股,都是新上市教育ETF的成分股。', '  2018年前年后,为分散单一市场的风险,很多基金公司纷纷推出QDII产品,也是那一年不少对标中概股的QDII基金净值走势十分漂亮,与对标A股的众基金形成鲜明对比。然而,即便提前设想了各种可能的风险,却依然无法预测来自市场和政策的“黑天鹅”。今年夏天,中概教育股的命运就随着股价而一去不复返。', '  自今年年初至今,校外培训行业经历一次次的政策洗礼,其盈利能力备受质疑。从目前教育行业的形势来分析,首只以教育为主题的基金,未来之路或许不是咬咬牙就能挺过去的了。我们以新东方教育为例,其股价从万琼6月建仓时约8美元每股,跌至7月23日的约2美元每股,跌去71.34%。', '  基民彻夜难眠', '  博时基金成立于1998年7月13日,是中国内地首批成立的五家基金管理公司之一,截止2021年一季度末,旗下有274只基金,资产规模8710.81亿,资产规模和净利润一直稳居公募基金行业TOP10,其中,基金经理70人,在业内中也是基金经理数量最多的基金公司', '  据公开资料显示,教育ETF成立于今年6月8日,基金经理为万琼,基金总份额2.56亿,为被动式投资的股票型指数基金,跟踪标的为中证全球中国教育主题指数(931456),其风险收益特征也与标的指数所表征的市场组合风险收益特征相似。', '  据了解,中证全球中国教育主题指数选取了全球上市的教育主题相关中国内地企业,目前包含的43只成分股中,有21家在A股上市,16家在港股上市,以及6家美股上市公司。教育ETF在发行中便表示,随着疫情的有效控制,学前教育、K12教育、大学教育等各教育子行业营收增速稳步提高,教育板块的未来发展是可观的。', '  此前,该基金产品经过一个多月的招募和延长募集,最终募集2.56亿元的博时全球中国教育(QDII-ETF)基金成立。截止7月24日,该基金最新净值为0.761元,较成立时跌去23.9%!虽然说万琼建仓时,中概教育股已经经历了近四个月的下跌。以新东方教育为例,该股最高点19.974美元出现在2月16日,至6月8日收盘价为8.55美元,已“腰斩”有余。7月24日,该股最低2.45美元,距离万琼建仓时,又跌去71.34%!', '  伴随着中概教育股大跌,自然引发基民担忧,教育股全线崩盘,这个基金也要废了吧,成立两个月不到,一直在亏损,下周一开盘是否会跌停?估计马上要清盘了吧。此前,可以一度满仓新东方的,幸好之前被媒体骂的惨,6月底都止损了。', '  长久以来,资本市场擅长于千变万幻,没有人知道谁会不期而遇。而每每“黑天鹅”所到之处,总有“受伤”的基金公司和基金经理引人侧目。而这一次,厄运之神抽中的则是博时基金和基金经理万琼。', '  那么,万琼是谁?据记者了解,万琼女士,硕士。2004年起先后在中企动力科技股份有限公司、华夏基金工作。2011年加入博时基金管理有限公司。历任投资助理、基金经理助理、博时富时中国A股指数证券投资基金(2017年9月29日-2019年9月5日)、上证超级大盘交易型开放式指数证券投资基金(2015年6月8日-2019年10月11日)、博时上证超级大盘交易型开放式指数证券投资基金联接基金(2015年6月8日-2019年10月11日)的基金经理。', '  虽然万琼具有近14年证券行业从业经验,并且素有“指数女神”之称,具有丰富的ETF产品管理经验。然而,此次万琼抄底教育黄金赛道,似乎对教育行业股票过于乐观。此外,万琼曾对外表示,自己是一位“乐观主义者”,面对压力的承受能力要强过一般人,即使在2015年的那次股灾中,也没有灰心丧气。那么,此次,面对这只成立不足两个月的新基金,净值就跌去四分之一,即便她对自己仍有信心,但基民似乎正在逐步失去耐性。']"
50,2021年07月23日 11:36,新东方在线举办校企合作开放日，为校园打开走进行业的新窗口,"['近日,新东方在线(01797.HK)与天津大学教育学院联合举办开放日活动,邀请教育学院的老师、学生代表来到公司实地参观,为师生们开启一次在线教育的真实体验。', '据悉,新东方在线与天津大学教育学院长期保持友好合作。除了人才招聘方面,双方在今年暑期已启动公益支教人才的联合培养。新东方在线相关负责人介绍:“此次举办开放日活动,是我们在校企合作领域的又一次全新探索,希望让同学们身临其境地感受、思考、理解在线教育行业。”', '抱着电脑远程开会的技术团队、对着摄像头比划字母的英语老师、装备美颜灯和手写板的直播间......这些工作场景,让同学们第一次看到了在线课堂屏幕背后的世界。', '为了打造沉浸感更强的在线课堂,新东方在线已经打破了行业内传统的三分屏直播,进化出半身直播,让主讲老师授课时能够兼顾知识讲解、趣味沟通。开放日上,一名主讲老师邀请同学们轮流体验半身直播间,帮助大家使用实时提问、在线发虚拟红包等功能,同学们也纷纷上台尝试面对多个屏幕上课的新奇体验。', '对于老师、同学们感兴趣的在线教师培养、企业管理、技术应用等话题,新东方在线教学相关负责人详细介绍了主讲教师的培养、晋升制度,用真实的授课案例解释一名新人如何逐步成长为成熟的主讲老师。', '为了让同学们实地感受入职后的企业管理风格,新东方在线培训相关负责人用“文化行为落地沙盘”,和老师、同学们模拟了一场公司价值观的讨论分享会,感受新东方在线扁平化、透明化、专业化的管理方式。在开放日现场,新东方在线招聘相关负责人也为同学们解答企业选人、用人标准等疑问,并对同学们的职业规划提供了针对性建议。 ', '开放日模式,为校企合作在实践中落地打开了一种新的思路。未来,新东方在线与天津大学教育学院计划在人才培养、教学研究等领域,继续探索更多新颖的合作形式,让专业院校与一线企业的知识、经验、资源实现双向联动,共同培养在线教育未来的新生力量。']"
51,2021年07月22日 17:57,2分钟读财报 | 新标准一发 老村长被“踢出”白酒界 牛栏山二锅头前途堪忧？,"['  作为新起之秀,老村长凭借低廉的酒价,成为光瓶酒有史以来全国覆盖率最高,深度分销做得最扎实的品牌之一,也是我国销量最大的白酒之一,然而最近老村长,却被“踢出”了白酒界。', '  近期国家出台了《白酒工业术语》、《饮料酒术语和分类》两项新标准。新标准规定了白酒饮料和相关术语的定义,明确了白酒分类的原则。众所周知,我国白酒工艺分液态法、固液法、固态法,随着国家新标准的实施,当下的液态法白酒、固液结合法白酒处境变得尴尬起来。', '  简单来说就是:6月以后酒配料中,但凡出现食用香料等食品添加剂的,即便是添加了白糖,将会直接被归于配制酒、酒精饮料,而不是白酒,并且不得用“白酒”的名义来卖。', '  国内多家白酒企业旗下原有的添加食用香料的光瓶酒,如牛栏山二锅头、老村长和枝江大曲等“固液法白酒”或者“液态法白酒”,除非改良原有酿酒配方,剔除其中的食品添加剂,不然以后都不能叫“白酒”。', '  白酒新国标的推出,无疑是加速茅台、郎酒、五粮液等纯粮食酒“一统白酒领域天下”的步伐。若不以白酒的名义来售卖,必定会对自家业绩产生影响,尤其是牛栏山和老村长,毕竟白牛二、老村长都是相关企业的主力产品,两者的前途堪忧。', '2分钟读财报|被爆训练记录造假和安全隐患华夏航空已涉信披违规?', '2分钟读财报|业绩不够、卖企鹅来凑?大连圣亚终究没逃过被*ST的命运', '2分钟读财报|盈利能力受质疑首日涨19倍的读客文化能走远吗']"
52,2021年07月25日 16:10,天正电气公布半年报 上半年净利增加57.87%,"['  炒股就看金麒麟分析师研报,权威,专业,及时,全面,助您挖掘潜力主题机会!', '  7月25日消息,天正电气发布半年度报告。', '  公告显示,公司半年度营业收入1,664,750,902.37元,同比增加57.57%,归属上市公司股东的净利润145,024,582.02元,同比增加57.87%。', '  公告显示,十大流通股东中,项光达、黄海洋、中国工商银行股份有限公司-交银施罗德趋势优先混合型证券投资基金、孟建荷、孙建洁、李湘云为新进流通股东。']"
53,2021年07月22日 14:33,驰援河南风雨同舟  多家房企在行动,"['  河南连日暴雨,汛情牵动全国人民的心。截至7月26日,多家开发商宣布捐款捐物支持郑州抗洪救灾,帮助受灾群众度过难关。', '  万科集团:5000万元', '  万科公益基金会向河南省红十字会捐赠5000万元,支援河南防汛抢险救灾工作。捐赠主要用于保障当地群众人身安全、采购紧急救灾物资和灾后重建工作。', '  万达集团:3000万元', '  近日,河南省郑州市发生持续暴雨、大暴雨天气,造成重大财产损失,为支持郑州抗洪救灾,帮助受灾群众渡过难关,万达集团于7月21日通过郑州市红十字会捐款3000万元。', '  融创中国:2000万元', '  7月21日,融创公益基金会宣布捐赠2000万人民币,助力河南省防汛救灾工作。捐款将用于保障受灾地区人民群众的生命安全、紧急救灾物资采购等。', '  龙湖集团:2000万元', '  7月21日,龙湖公益基金会宣布通过重庆光彩事业基金会,向郑州市慈善总会捐赠2000万元,紧急驰援河南暴雨灾害,用于保障当地群众的人身、财产安全,采购紧急救灾物资和支援灾后重建工作。', '  复星集团:5000万元', '  7月21日中午,上海复星公益基金会宣布捐赠5000万元人民币资金和物资,紧急驰援河南尤其是郑州等受洪灾影响严重地区。', '  恒大集团:2000万元', '  恒大集团向河南省慈善总会捐款2000万元,用于紧急救助物资采购、群众安全保障及灾后重建工作。同时,集团旗下驻河南各产业板块将全力以赴,助力政府和社会各界抗险救灾。', '  新城控股:2000万元', '  7月21日,新城控股宣布,公司决定向河南省慈善总会捐赠2000万元人民币,紧急驰援河南省抗险救灾工作。捐赠将主要用于保障当地群众人身安全、采购救灾物资和灾后恢复重建工作,助力当地帮扶救助。', '  建业集团:500万元', '  建业集团向郑州市红十字会捐赠现金500万元设立“建业防汛抗灾专项基金”,并同时采购救援物资支持受灾地区与群众。', '  龙光集团:1000万元', '  7月21日,龙光慈善基金会通过深圳市慈善会捐赠1000万元,支援河南防汛救灾工作。', '  中梁控股:100万元', '  7月21日,中梁控股集团决定向河南省红十字会捐赠100万元,支援河南防汛抢险救灾工作。捐款将用于保障受灾地区人民群众的生命安全、紧急救灾物资采购等。', '  旭辉集团:1000万元', '  7月21日,旭辉公益基金会宣布捐赠1000万元,紧急驰援河南防汛救灾,并将持续关注灾情发展,发挥自身优势,躬身入局,积极参与灾后重建工作。旭辉称,公司将尽全力配合当地救援行动,为抗洪救灾、灾后重建尽一份自己的绵薄之力。与此同时,旭辉永升服务正奋斗在抗洪第一线,用点滴行动,护业主安全。', '  贝壳集团:1100万元', '  灾情发生后,贝壳公益基金会第一时间向中国扶贫基金会捐赠100万,为灾民采购救急粮油;贝壳找房向河南省红十字会追加捐赠1000万,用于救灾紧急举措和灾后恢复工作。', '  永威置业:200万元', '  永威置业集团时刻关注汛情,积极防汛救灾,并于7月21日,向郑州市红十字会捐赠100万元善款,另投入100万元采购救灾物资,驰援各救援机构救灾防疫所需,助力郑州市防汛救灾攻坚战!', '  星联芒果集团:100万元', '  7月21日,星联芒果集团宣布通过河南星联教育基金会捐赠100万元,用于教育救灾资助,以助力河南防汛救灾工作。首批30万元捐赠资金将用于二七区马寨镇政府所辖的燕蓉希望小学、张砦小学、水磨小学3所学校的灾后重建,帮助学校尽快恢复教学秩序。', '  康桥集团:500万元', '  7月21日,康桥集团宣布,决定向郑州市慈善总会捐赠人民币500万元,紧急驰援郑州市抗险救灾工作,捐赠将主要用于保障当地群众人身安全、采购救灾物资和灾后恢复重建工作,助力当地帮扶救助。', '  邦泰集团:100万元', '  7月21日,邦泰集团联合中国儿童少年基金会,捐赠100万元爱心物资,紧急驰援河南受灾地区,全力协助抗洪救灾工作。该批物资将用于受灾地区儿童及家庭应急救援、灾区防疫、受灾群众生活保障等。', '  宝龙集团:1000余万元', '  7月22日,宝龙公益基金会宣布捐赠1000万元,紧急驰援河南防汛救灾,捐款将用于保障受灾地区人民群众的生命安全、采购紧急救灾物资和灾后重建工作。同时,向中国妇女发展基金会捐赠50万元,支援灾情发生地区的妇女儿童及家庭保障工作。', '  佳兆业集团:1000万元', '  7月22日,佳兆业集团通过广东省慈善总会捐赠1000万元人民币,全力支援河南省防汛救灾工作,捐赠将主要用于保障当地群众生命财产安全、采购救灾物资和灾后重建工作。', '  碧桂园集团:2000万元', '  得知部分地区受灾严重,碧桂园集团、碧桂园服务、国强公益基金会联动碧桂园在河南的8个区域立即行动,紧急采购了防汛救灾、生活、医疗等价值2000万元的首批物资,陆续发往受灾地区,助力防汛抢险救灾及灾后重建。同时,碧桂园集团、国强公益基金会还通过中国青年志愿者协会捐赠200万元,支持志愿者组织开展救灾救援行动。', '  华侨城集团:1000万', '  为支持河南省防汛救灾工作,7月22日,华侨城集团有限公司通过河南省慈善总会向河南灾区捐款1000万元,用于防汛救灾和灾后重建工作。', '  第一太平戴维斯:40万元', '  面对天灾,守望同胞,第一太平戴维斯中国区董事会一致决议向河南省慈善总会捐赠人民币40万元,用于当地抗洪救灾以及灾后重建工作。', '  保利集团:1000万元', '  为支援河南省防汛抢险救灾工作,保利集团在7月22日下午向河南省慈善总会紧急捐款1000万元人民币,为防汛抢险和灾后重建工作贡献保利力量。', '  中国绿发:1000万元', '  7月23日,中国绿发坚决贯彻习近平总书记关于防汛救灾工作的重要指示精神,落实党中央、国务院决策部署,通过河南省慈善总会紧急捐款1000万元,支援河南省防汛救灾和灾后重建工作。', '  湖北卓尔:300万元', '  7月23日,卓尔公益基金会组织100辆满载应急生活物资的冷藏车和厢式货车,从武汉汉口北出发,驶往河南周口地区,捐送给当地受灾群众。紧急筹集和采购的价值300万元的生活物资,包括矿泉水、方便食品、消毒水、新鲜水果等,用于当地转移安置群众的生活物资补给。', '  汇景控股:100万元', '  7月23日,汇景控股向河南捐款100万人民币,该款项将用于紧急救助物资采购、群众安全保障及灾后重建工作。', '  当代置业:300万元', '  7月23日,当代置业联合当代绿健养老产业公司向中华慈善总会捐赠价值300万元物资助力河南省防汛救灾,物资将用于支持保障受灾群众安全及灾后重建等工作。', '  河南荣盛:驰援物资抵达郑州', '  7月23日晚上22:00,荣盛满载生活物资的车辆抵达郑州荣盛华筑、荣盛花语水岸项目,其中包括1000箱饮用水、四万余斤时令蔬菜等。据悉,这是荣盛发展运抵郑州的第二批救援物资。', '  世茂集团:2000万港币', '  为支援河南省防汛抢险救灾工作,7月23日,世茂集团宣布,通过中央政府驻港联络办赈灾专户,捐赠2000万港币,为防汛抢险和灾后重建工作贡献力量。', '  绿城中国:1000万元', '  7月24日,绿城捐款捐物1000万元、增派专业人员,驰援河南,帮助灾区恢复生产生活。', '  恒基兆业地产:1000万元', '  7月24日,继香港恒基兆业地产集团主席、香港中华煤气有限公司主席李家杰博士向河南省郑州市8家受灾医院捐赠53万份应急食品物资后,为支持河南防汛救灾工作,恒基兆业地产集团宣布向河南省捐赠人民币1000万元,本次捐款将通过中央政府驻港联络办赈灾专户完成捐赠。集团主席李家杰个人捐赠价值500万元的应急食品及物资。', '  华侨城:闻“汛”而动,坚守一线', '  面对突如其来的汛情,郑州华侨城快速启动防汛应急预案,迅速组织广大党员干部、职工应急抢险,及时将险情控制在可控范围内,确保无人员伤亡及无重大财产损失。', '  华润置地、华润万象生活:积极动员各方力量、筹措物资', '  华润置地、华润万象生活第一时间启动防汛应急救援预案,积极配合政府部门,各项目一线员工以时刻奔跑的姿态坚守防汛应急前线,确保24小时不间断做好服务工作,实现各项安全防护措施落实到位。', '  绿地集团:多举措驰援河南暴雨灾情', '  绿地集团第一时间安排部署防汛救灾工作,多举措驰援河南暴雨灾情,郑州多个办公商业项目开放提供避难场所、旗下多家酒店免费接待受困群众、物业人员加入防洪抗险、绿地优选超市提供民生补给。', '  苏宁易购:免费开放郑州物流基地、全力支持救灾物资配送', '  苏宁物流同步面向政府、企事业单位、慈善基金组织免费开放郑州苏宁物流基地以及河南全省10余个转运中心,承接各类救援物资的仓储服务。目前,苏宁物流在不断组织郑州以及周边地区运输车队以及配送力量,响应政府要求,全力投入到抢险救灾和物资配送中。', '  新城悦:不忘初心,风“豫”同“州”', '  灾情发生后,新城悦服务第一时间启动了内部应急响应,灾区属地的所有机构、人员,立即积极投入抗灾救灾,为灾区业主和市民提供一切力所能及的帮助和服务,以生命财产为第一原则。', '  彩生活服务集团:', '  彩生活服务集团身处河南的物业人火速集结,迅速成立防洪抗汛应急小组。', '  中海地产郑州公司:', '  面对极端天气情况,中海地产郑州公司迅速响应,做好安全防范工作,并积极救助各项目附近的受困人员。', '  蓝光嘉宝服务:奋战48小时,在河南与暴雨搏斗', '  蓝光嘉宝服务华中华南区域领导高度重视河南省各项目防汛工作进展,做出使用紧急进场方式采购防汛物资的指示,为各项目打开紧急采购通道,保障了现场的物资及时供给。']"
